quest_alchemist_infiltrate_laboratory_desc;The greedy and paranoid [FromFrom.GetSocietyRank] [FromFrom.GetFirstName] guards [FromFrom.GetHerHis] secrets jealously. A most shameful behavior, indeed! Unlike [FromFrom.GetHerHim], you know how to share. In the spirit of collaboration, you and a colleague has agreed to infiltrate [FromFrom.GetFirstName]'s laboratory and either steal or destroy anything of value. Perhaps you will do both!;;;;;;;;;;;;;x
quest_alchemist_infiltrate_laboratory_tooltip;Your colleague will bring you to the laboratory of §Y[FromFrom.GetTitledFirstName]§!. If you manage to steal or destroy anything and get away unnoticed, the mission is completed.;;;;;;;;;;;;;x
quest_alchemist_laboratory_experiment;Conduct Laboratory Experiment;;;;;;;;;;;;;x
quest_alchemist_laboratory_experiment_desc;It would be a waste not to put your laboratory to use, and it is very possible a great many insights into various ingredients could be obtained from a laboratory experiment.;;;;;;;;;;;;;x
quest_alchemist_laboratory_experiment_tooltip;To complete this mission, activate the decision §Y'Conduct Laboratory Experiment'§! in the Intrigue menu, and then you need to obtain some useful insights from the experiments.;;;;;;;;;;;;;x
quest_alchemist_prisoner_experiment;Conduct Potion Test;;;;;;;;;;;;;x
quest_alchemist_prisoner_experiment_desc;A [Root.GetTitle] might sometimes be inclined to release a prisoner that has proven their willingness to leave their criminal past behind by providing a service to the realm, and what greater service is there than to help out with a scientific experiment. Some might even consider it a one-in-a-lifetime opportunity!;;;;;;;;;;;;;x
quest_alchemist_prisoner_experiment_tooltip;To complete this mission you need to §Gright-click§! the portrait of one of your prisoners and choose §YConduct Potion Test§!, and the prisoner needs to agree to take part in the potion test in question.;;;;;;;;;;;;;x
quest_alchemist_immortality_potion;Brew Immortality Potion;;;;;;;;;;;;;x
quest_alchemist_immortality_potion_desc;The ultimate goal for any self-respecting member of the Righteous Apothecary Society - and the ultimate test of their skills as a Grand Apothecary - the creation of a working Immortality Potion is not to be undertaken lightly.;;;;;;;;;;;;;x
quest_alchemist_immortality_potion_tooltip;To complete this mission, you need to successfully brew a working Immortality Potion for either yourself or your liege, whether by using the §Y'Brew Immortality Potion'§! decision in the Intrigue menu or as a result of agreeing to a request from your liege. Successfully brewing a deadly poison in the guise of an Immortality Potion does not count as a success, nor any other outcome other than immortality.;;;;;;;;;;;;;x