EVTDESC_SOH_3601;I have decided to embark on a pilgrimage to a significant site for the [Root.Religion.GetName] faith. It will doubtlessly be a long journey, but I think that it will be a worthwhile endeavor, and doubtlessly others belonging to the [Root.Religion.GetName] faith will look on me more favorably once I return home.;;;;;;;;;;;;;x
EVTOPTA_SOH_3601;I will prove my devotion!;;;;;;;;;;;;;x
EVTDESC_SOH_3602;The kami are everywhere, and so are their servants and shrines. However, a pilgrimage needs to be to a significant location for anyone to take it seriously, and that gives me a smaller number of options.;;;;;;;;;;;;;x
EVTOPTA_SOH_3602;I will visit the court of the [the_tenno.GetTitle]!;;;;;;;;;;;;;x
EVTOPTB_SOH_3602;I will visit the grand shrine at Ise!;;;;;;;;;;;;;x
EVTOPTC_SOH_3602;I will walk the Kumano route!;;;;;;;;;;;;;x
EVTOPTD_SOH_3602;I will visit Mount Fuji!;;;;;;;;;;;;;x
EVTDESC_SOH_3603;There are certain sites in Japan to make a pilgrimage to, and those are generally where pilgrims like me would go, but as the Buddhist faith is rather widespread there are of course also other sites to be found elsewhere.;;;;;;;;;;;;;x
EVTOPTA_SOH_3603;I will visit the many sites in Shikoku!;;;;;;;;;;;;;x
EVTOPTB_SOH_3603;I will visit Mount Koya!;;;;;;;;;;;;;x
EVTOPTC_SOH_3603;I will head outside Japan!;;;;;;;;;;;;;x
EVTDESC_SOH_3604;It is time to leave on my pilgrimage. Though it is possible that the journey will be both long and difficult I feel that I have made adequate preparations, and there is no reason to delay things any further.;;;;;;;;;;;;;x
EVTOPTA_SOH_3604;I will prove my faith!;;;;;;;;;;;;;x
EVTDESC_SOH_3606;A pilgrim is generally expected to be an ascetic during their pilgrimage, and thus should avoid various immoral actions. I have of course been considering adhering to this during my pilgrimage, but perhaps it would be worse to try and fail than to not try at all.;;;;;;;;;;;;;x
EVTOPTA_SOH_3606;Ascetism is commendable!;;;;;;;;;;;;;x
EVTOPTB_SOH_3606;Ascetism isn't for me...;;;;;;;;;;;;;x
EVTDESC_SOH_3607;One day during my pilgrimage I encounter a wandering priest devoted to the [Root.Religion.GetName] faith. He inquires about my pilgrimage so far and is quite pleased when I tell him that I am making an effort to be ascetic, telling you that it is commendable and something that many struggle with..;;;;;;;;;;;;;x
EVTOPTA_SOH_3607;I will be a better person!;;;;;;;;;;;;;x
EVTDESC_SOH_3608;After making the decision to try to be ascetic during my pilgrimage I have been considering how I am living my life in general, and I have concluded that one of my flaws is that I am rather proud. I have decided that this is something I should put behind me.;;;;;;;;;;;;;x
EVTOPTA_SOH_3608;I will be a better person!;;;;;;;;;;;;;x
EVTDESC_SOH_3609;After making the decision to try to be ascetic during my pilgrimage I have been considering how I am living my life in general, and I have concluded that one of my flaws is that I am rather gluttonous. I have decided that this is something I should put behind me.;;;;;;;;;;;;;x
EVTOPTA_SOH_3609;I will be a better person!;;;;;;;;;;;;;x
EVTDESC_SOH_3610;After making the decision to try to be ascetic during my pilgrimage I have been considering how I am living my life in general, and I have concluded that one of my flaws is that I am rather lustful. I have decided that this is something I should put behind me.;;;;;;;;;;;;;x
EVTOPTA_SOH_3610;I will be a better person!;;;;;;;;;;;;;x
EVTDESC_SOH_3611;After making the decision to try to be ascetic during my pilgrimage I have been considering how I am living my life in general. Though I would not have said that I am overly proud, I have still concluded that I definitely could be a bit more humble, and I think I have taken a step in the right direction.;;;;;;;;;;;;;x
EVTOPTA_SOH_3611;I made the right choice!;;;;;;;;;;;;;x
EVTDESC_SOH_3612;After making the decision to try to be ascetic during my pilgrimage I have been considering how I am living my life in general. Though I would not have said that I am overly gluttonous, I have still concluded that I definitely could be a bit more temperate, and I think I have taken a step in the right direction.;;;;;;;;;;;;;x
EVTOPTA_SOH_3612;I made the right choice!;;;;;;;;;;;;;x
EVTDESC_SOH_3613;After making the decision to try to be ascetic during my pilgrimage I have been considering how I am living my life in general. Though I would not have said that I could be considered particularly lustful, I have still concluded that I definitely could be a bit more chaste, and I think I have taken a step in the right direction.;;;;;;;;;;;;;x
EVTOPTA_SOH_3613;I made the right choice!;;;;;;;;;;;;;x
EVTDESC_SOH_3614;Though I decided that I wanted to be more ascetic during my pilgrimage I have not really been making much of an effort, and after a while on the road I conclude that I will not be able to really devote myself to this. It is bit shameful to know that I failed to do the right thing, even if only I know.;;;;;;;;;;;;;x
EVTOPTA_SOH_3614;At least I tried...;;;;;;;;;;;;;x
EVTDESC_SOH_3615;One day during my pilgrimage I encounter a wandering priest devoted to the [Root.Religion.GetName] faith. He inquires about my pilgrimage so far, and when he learns just how little effort I have put into being ascetic he gets upset and calls me out on not being as devout as I should be.;;;;;;;;;;;;;x
EVTOPTA_SOH_3615;At least I tried...;;;;;;;;;;;;;x
EVTDESC_SOH_3616;I decided that being ascetic during my pilgrimage would not be a good idea, and though a pilgrimage is a time to reflect on my faith and try to better myself I have instead been reconsidering how strictly I should follow its teachings, concluding that it would not necessarily be wrong for me to be a bit more proud.;;;;;;;;;;;;;x
EVTOPTA_SOH_3616;I must be true to myself...;;;;;;;;;;;;;x
EVTDESC_SOH_3617;I decided that being ascetic during my pilgrimage would not be a good idea, and though a pilgrimage is a time to reflect on my faith and try to better myself I have instead been reconsidering how strictly I should follow its teachings, concluding that it would not necessarily be wrong for me to be a bit more gluttonous.;;;;;;;;;;;;;x
EVTOPTA_SOH_3617;I must be true to myself...;;;;;;;;;;;;;x
EVTDESC_SOH_3618;I decided that being ascetic during my pilgrimage would not be a good idea, and though a pilgrimage is a time to reflect on my faith and try to better myself I have instead been reconsidering how strictly I should follow its teachings, concluding that it would not necessarily be wrong for me to be a bit more lustful.;;;;;;;;;;;;;x
EVTOPTA_SOH_3618;I must be true to myself...;;;;;;;;;;;;;x
EVTDESC_SOH_3619;I decided that being ascetic during my pilgrimage would not be a good idea, and though a pilgrimage is a time to reflect on my faith and try to better myself I have instead been reconsidering how strictly I should follow its teachings, concluding that it would not necessarily be wrong for me to be a bit less humble.;;;;;;;;;;;;;x
EVTOPTA_SOH_3619;I must be true to myself...;;;;;;;;;;;;;x
EVTDESC_SOH_3620;I decided that being ascetic during my pilgrimage would not be a good idea, and though a pilgrimage is a time to reflect on my faith and try to better myself I have instead been reconsidering how strictly I should follow its teachings, concluding that it would not necessarily be wrong for me to be a bit less temperate.;;;;;;;;;;;;;x
EVTOPTA_SOH_3620;I must be true to myself...;;;;;;;;;;;;;x
EVTDESC_SOH_3621;I decided that being ascetic during my pilgrimage would not be a good idea, and though a pilgrimage is a time to reflect on my faith and try to better myself I have instead been reconsidering how strictly I should follow its teachings, concluding that it would not necessarily be wrong for me to be a bit less chaste.;;;;;;;;;;;;;x
EVTOPTA_SOH_3621;I must be true to myself...;;;;;;;;;;;;;x
EVTDESC_SOH_3622;I knew that there possibly would be those that would be unhappy when I made the decision not to focus on ascetism during my pilgrimage, and I have been worrying a bit about someone lecturing me about it, but as far as I can tell nobody has seemed to care about me being less than ascetic during my pilgrimage.;;;;;;;;;;;;;x
EVTOPTA_SOH_3622;It was the right decision!;;;;;;;;;;;;;x
EVTDESC_SOH_3623;One day on the road I come across a crippled dog with only three legs. It appears to have trouble walking, and whimpers from time to time. Though I know that I am supposed to refrain from killing during a pilgrimage, it is perhaps the lesser evil in a situation like this, since the dog clearly is suffering.;;;;;;;;;;;;;x
EVTOPTA_SOH_3623;I won't take its life!;;;;;;;;;;;;;x
EVTOPTB_SOH_3623;I can give it a quick death...;;;;;;;;;;;;;x
EVTOPTC_SOH_3623;It doesn't know suffering... yet!;;;;;;;;;;;;;x
EVTDESC_SOH_3624;The dog follows me for a while despite having trouble walking, and it makes me feel rather sad that I cannot help it in any way. However, as I reach the next village one of the villagers takes pity on the dog and declares that he will adopt it and do what he can for it, which certainly is a welcome development.;;;;;;;;;;;;;x
EVTOPTA_SOH_3624;It is good that someone cares!;;;;;;;;;;;;;x
EVTDESC_SOH_3625;Leaving the crippled dog behind I find myself reflecting on my normal approach to things, which often is violent, and perhaps a bit more cruel than it has to be. Though I would not go as far as to say that it is always wrong to use violence I should really try to be less cruel in the future.;;;;;;;;;;;;;x
EVTOPTA_SOH_3625;I should be kinder!;;;;;;;;;;;;;x
EVTDESC_SOH_3626;I leave the crippled dog behind but find my thoughts returning to it several times during the following days. Though I could not have brought it with me I feel that there have been other situations in the past where I could have been a bit more helpful, and I decide that I should focus more on kindness in the future.;;;;;;;;;;;;;x
EVTOPTA_SOH_3626;Kindness is the right path!;;;;;;;;;;;;;x
EVTDESC_SOH_3627;I leave the crippled dog behind but find my thoughts returning to it several times during the following days. It was unfortunate that I could not help it, but the only option I saw was to give it the mercy of a quick death, which would have been ever worse than leaving it since I should not kill during a pilgrimage.;;;;;;;;;;;;;x
EVTOPTA_SOH_3627;Poor dog!;;;;;;;;;;;;;x
EVTDESC_SOH_3628;I draw my sword and approach the dog, striking swiftly and killing it before it can react. Unfortunately for me, another pilgrim is walking by as it happens, and he sees fit to berate me, claiming that it is more important for me to focus on my pilgrimage and what is proper during that than anything else.;;;;;;;;;;;;;x
EVTOPTA_SOH_3628;Oh, shut up!;;;;;;;;;;;;;x
EVTDESC_SOH_3629;There was a time where I would not have seen fit to make the suffering of an animal shorter and perhaps even would have seen fit to draw it out, but I have decided that that is behind me and grant the dog a swift death. Though I would not go as far as to renounce violence I feel I could be less cruel in the future.;;;;;;;;;;;;;x
EVTOPTA_SOH_3629;That was a kindness...;;;;;;;;;;;;;x
EVTDESC_SOH_3630;I draw my sword and approach the dog, striking swiftly and killing it before it can react. Though killing is not something I am supposed to do during a pilgrimage, letting an animal suffer needlessly seems worse to me. It is perhaps not a sentiment everyone would agree with, but in this particular instance I do not care.;;;;;;;;;;;;;x
EVTOPTA_SOH_3630;That was a kindness...;;;;;;;;;;;;;x
EVTDESC_SOH_3631;I draw my sword and approach the dog, striking swiftly and killing it before it can react. With that done, I wipe my sword clean and sheathe it once more, then continue on my way. Mu pilgrimage is far from over, and I cannot afford to be distracted or delayed.;;;;;;;;;;;;;x
EVTOPTA_SOH_3631;That was a kindness...;;;;;;;;;;;;;x
EVTDESC_SOH_3632;The crippled dog suspects nothing as I approach, and a precise cut with my sword severs one of the tendons in one of its remaining legs. It lets out a sound that is half a growl and half a whimper as it attempts to escape, but I ensure that that is not an option, and I spend the rest of the day inflicting further tortures on it;;;;;;;;;;;;;x
EVTOPTA_SOH_3632;That was fun!;;;;;;;;;;;;;x
EVTDESC_SOH_3633;The crippled dog suspects nothing as I approach, and a precise cut with your sword severs one of the tendons in one of its remaining legs. It lets out a sound that is half a growl and half a whimper as it attempts to escape, but I ensure that that is not an option, and I spend the rest of the day inflicting further tortures on it.;;;;;;;;;;;;;x
EVTOPTA_SOH_3633;That ended too soon!;;;;;;;;;;;;;x
EVTDESC_SOH_3634;I have been told that a pilgrim following the [Root.Religion.GetName] religion should avoid saying anything that could be considered immoral during the pilgrimage, and I have tried to behave acoordingly. However, in one village I come across an attractive villager, and I start questioning this prohibition.;;;;;;;;;;;;;x
EVTOPTA_SOH_3634;I can say some immoral things...;;;;;;;;;;;;;x
EVTOPTB_SOH_3634;It is wrong!;;;;;;;;;;;;;x
EVTDESC_SOH_3635;The attractive villager I made the comment do did appreciate what I say and tells me that I should know better than to engage in such behavior during a pilgrimage before leaving. Though word of what happened hopefully will not spread I still feel a bit humiliated by the experience, and I am convinced that I made a mistake.;;;;;;;;;;;;;x
EVTOPTA_SOH_3635;It was just a joke!;;;;;;;;;;;;;x
EVTDESC_SOH_3636;The villager ignored my immoral words and leaves without comment. I am not certain what they thought of what I said, but it is quite clear that it was not as effective as I would have liked, and perhaps it was a mistake to not adhere to the supposed rules for a pilgrimage.;;;;;;;;;;;;;x
EVTOPTA_SOH_3636;That could have gone worse...;;;;;;;;;;;;;x
EVTDESC_SOH_3637;The [pilgrims_lover.GetManWoman] is quite receptive to my words, and [pilgrims_lover.GetSheHe] gives me a smile and suggests that perhaps the two of us should head somewhere more private to perhaps to engage in certain other activities that might be of interest to me.;;;;;;;;;;;;;x
EVTOPTA_SOH_3637;But of course!;;;;;;;;;;;;;x
EVTOPTB_SOH_3637;I don't think so!;;;;;;;;;;;;;x
EVTDESC_SOH_3638;[pilgrims_lover.GetBestName] and I spend the night in each other's arms, and when the morning comes and I am about to leave [pilgrims_lover.GetSheHe] asks me whether the two of us will meet again. I cannot bring [pilgrims_lover.GetHerHim] with we on my journey, of course, but that does not necessarily mean we must be apart forever.;;;;;;;;;;;;;x
EVTOPTA_SOH_3638;I have a place for you at home!;;;;;;;;;;;;;x
EVTOPTB_SOH_3638;I don't want to see you again!;;;;;;;;;;;;;x
EVTDESC_SOH_3639;I resolve to say nothing immoral and continue on my way. A few villages later I overhear another pilgrim make immoral comments nearby, and the townspeople are quick to berate him. He is clearly humiliated by the experience, and it is likely that I made the right decision before.;;;;;;;;;;;;;x
EVTOPTA_SOH_3639;Something to remember...;;;;;;;;;;;;;x
EVTDESC_SOH_3640;Though there was a time when I would have seen fit to make immoral comments to nearly every person I thought would be receptive I have started to feel that this is something that I should put behind me, not just for the duration of the pilgrimage but perhaps forever, as I want to try to be a better person.;;;;;;;;;;;;;x
EVTOPTA_SOH_3640;Begone, lust!;;;;;;;;;;;;;x
EVTDESC_SOH_3641;I continue on my way and reflect on what I choose not to do a bit during the following days. Though I previously have not felt overly strongly on the subject of chastity I am starting to feel differently now, and I resolve to live my life in a chaste fashion from now on, as that feels quite appropriate.;;;;;;;;;;;;;x
EVTOPTA_SOH_3641;Chastity is right!;;;;;;;;;;;;;x
EVTDESC_SOH_3642;I decide not to make an immoral comment and continue on my way, not feeling particularly strongly about the decision and not thinking too much about it over the course of the next few days. After all, I am on an important journey and have plenty of things to think about, and cannot afford to dwell on a small detail overly long.;;;;;;;;;;;;;x
EVTOPTA_SOH_3642;Onwards!;;;;;;;;;;;;;x
EVTDESC_SOH_3643;I am aware that one of the rules pilgrims are supposed to adhere to during a pilgrimage is to abstain from alcohol, and I have been doing that so far even though I usually drink some on a somewhat frequent basis. However, one evening when I am having a meal at an inn one of the patrons there offers to buy me a drink.;;;;;;;;;;;;;x
EVTOPTA_SOH_3643;Sorry, but I don't drink!;;;;;;;;;;;;;x
EVTOPTB_SOH_3643;One drink won't hurt...;;;;;;;;;;;;;x
EVTDESC_SOH_3644;The patron that offered to buy me a drink seems a bit surprised by me turning down his offer, and he leaves the inn before long. After he has left some of the other patrons note that the man has made a habit of trying to trick pilgrims into drinking and that many pilgrims fail to refuse. They are evidently quite impressed by my resolve.;;;;;;;;;;;;;x
EVTOPTA_SOH_3644;I made the right decision!;;;;;;;;;;;;;x
EVTDESC_SOH_3645;I refuse the offer of a drink, and the man who offered it to me merely shrugs and goes looking for another drinking partner. Noting that their behavior becomes worse and worse during the course of the evening as they drink more and more, I decide that I made the right decision, and also that I should try to be a bit more temperate in general.;;;;;;;;;;;;;x
EVTOPTA_SOH_3645;Temperance is the right path!;;;;;;;;;;;;;x
EVTDESC_SOH_3646;I refuse the offer of a drink, and the man who offered it to me merely shrugs and goes looking for another drinking partner. The rest of the evening is uneventful, and I have a good night's sleep and a quick breakfast shortly after dawn before once more setting off on my journey, eager to reach my destination.;;;;;;;;;;;;;x
EVTOPTA_SOH_3646;Onwards!;;;;;;;;;;;;;x
EVTDESC_SOH_3647;I accept the man's offer to buy me a drink, and once I start drinking I find that I have been missing it more than I thought I had. I order some more drinks after finishing the first, and decide that I really should not focus so much on temperance in the future as it simply is not worth the trouble.;;;;;;;;;;;;;x
EVTOPTA_SOH_3647;I can indulge some more...;;;;;;;;;;;;;x
EVTDESC_SOH_3648;I accept the man's offer to buy me a drink, and drink it slowly once I receive it, intending for it to be the only drink I have. Before I have finished my drink another pilgrim enters the common room of the inn and notices that I am drinking, and he is quick to call me out for not avoiding alcohol during my pilgrimage.;;;;;;;;;;;;;x
EVTOPTA_SOH_3648;Oh, shut up!;;;;;;;;;;;;;x
EVTDESC_SOH_3649;I accept the man's offer to buy me a drink, and drink it slowly once I receive it, intending for it to be the only drink I have. I have no trouble keeping that promise to myself, and the evening passes without anything notable happening. After a good night's sleep I have a quick breakfast before leaving the inn, eager to reach my destination.;;;;;;;;;;;;;x
EVTOPTA_SOH_3649;Onwards!;;;;;;;;;;;;;x
EVTDESC_SOH_3650;I accept the man's offer to buy me a drink, and down in quickly after I receive it. Finding it to your taste, I order another, and then several more after that. The rest of the evening is a blur, and the next morning I wake up on the floor of the common room with a severe headache, which gets worse every time someone speaks louder than a whisper.;;;;;;;;;;;;;x
EVTOPTA_SOH_3650;That... was a mistake...;;;;;;;;;;;;;x
EVTDESC_SOH_3651;One day on the road I come across a fellow pilgrim. The woman does not look pleased to see that she has company all of a sudden, and when it becomes clear that the two of us are heading in the same direction she starts complaining about how I have ruined the pilgrimage before launching into a series of insults.;;;;;;;;;;;;;x
EVTOPTA_SOH_3651;I cannot let this slide...;;;;;;;;;;;;;x
EVTOPTB_SOH_3651;I should try to de-escalate...;;;;;;;;;;;;;x
EVTDESC_SOH_3652;I inform the woman that she is being most unreasonable and should expect to share the road, and also tell her that she owes me an apology. She will have none of it, and an argument predictably breaks out. I am quite certain that she is the unreasonable party.;;;;;;;;;;;;;x
EVTOPTA_SOH_3652;I am right, you are wrong!;;;;;;;;;;;;;x
EVTDESC_SOH_3653;I inform the woman that she is being most unreasonable and should expect to share the road, and also tell her that she owes me an apology. She will have none of it, and an argument predictably breaks out. A [Root.GetManWoman] of my rank should not have to endure such poor company!;;;;;;;;;;;;;x
EVTOPTA_SOH_3653;I deserve better!;;;;;;;;;;;;;x
EVTDESC_SOH_3654;I inform the woman that she is being most unreasonable and should expect to share the road, and also tell her that she owes me an apology. She will have none of it, and an argument predictably breaks out. Though I would consider myself a humble person, I deserve better than this!;;;;;;;;;;;;;x
EVTOPTA_SOH_3654;I am not at fault!;;;;;;;;;;;;;x
EVTDESC_SOH_3655;I inform the woman that she is being most unreasonable and should expect to share the road, and also tell her that she owes me an apology. She will have none of it, and an argument predictably breaks out as my patience has reached its limit.;;;;;;;;;;;;;x
EVTOPTA_SOH_3655;I have no patience for fools!;;;;;;;;;;;;;x
EVTDESC_SOH_3656;I inform the woman that she is being most unreasonable and should expect to share the road, and also tell her that she owes me an apology. She will have none of it, and an argument predictably breaks out, and I feel more than justified in returning her insults.;;;;;;;;;;;;;x
EVTOPTA_SOH_3656;The time for kindness is over!;;;;;;;;;;;;;x
EVTDESC_SOH_3657;I inform the woman that she is being most unreasonable and should expect to share the road, and also tell her that she owes me an apology. She will have none of it, and an argument predictably breaks out, and I inform the woman that she will pay dearly the next time she insults me.;;;;;;;;;;;;;x
EVTOPTA_SOH_3657;Insult me and you'll regret it!;;;;;;;;;;;;;x
EVTDESC_SOH_3658;I inform the woman that she is being most unreasonable and should expect to share the road, and also tell her that she owes me an apology. She will have none of it, and an argument predictably breaks out, and I see no reason to hold back when it comes to returning the insults with interest.;;;;;;;;;;;;;x
EVTOPTA_SOH_3658;Run away and cry!;;;;;;;;;;;;;x
EVTDESC_SOH_3659;I inform the woman that she is being most unreasonable and should expect to share the road, and also tell her that she owes me an apology. She will have none of it, and an argument predictably breaks out. Our quarrel attracts the attention of a priestess that is passing by, and she berates both of us.;;;;;;;;;;;;;x
EVTOPTA_SOH_3659;I didn't start it!;;;;;;;;;;;;;x
EVTDESC_SOH_3660;I inform the woman that she is being most unreasonable and should expect to share the road, and also tell her that she owes me an apology. She declares that she is unwilling to share the road with me or give me an apology, and takes off in a different direction as soon as she can.;;;;;;;;;;;;;x
EVTOPTA_SOH_3660;Good riddance!;;;;;;;;;;;;;x
EVTDESC_SOH_3661;I calmly explain to the woman that I am just another pilgrim and that this is the best route for me, and she listens to my words before offering me what appears to be a sincere apology. Though I felt tempted to return her insults with interest I conclude that it was the right decision to go for something more diplomatic.;;;;;;;;;;;;;x
EVTOPTA_SOH_3661;Cruelty is uncalled for!;;;;;;;;;;;;;x
EVTDESC_SOH_3662;I calmly explain to the woman that I am just another pilgrim and that this is the best route for me, and she listens to my words before offering me what appears to be a sincere apology. Though I felt tempted to threaten her with violence when she insulted me I conclude that it was the right decision to go for something more diplomatic.;;;;;;;;;;;;;x
EVTOPTA_SOH_3662;I know how to keep my temper!;;;;;;;;;;;;;x
EVTDESC_SOH_3663;I calmly explain to the woman that I am just another pilgrim and that this is the best route for me, and she listens to my words before offering me what appears to be a sincere apology. Though there are many that would have resorted to violence or that would have returned the insults I feel that approaching the matter with kindness was correct.;;;;;;;;;;;;;x
EVTOPTA_SOH_3663;Kindness is the right path!;;;;;;;;;;;;;x
EVTDESC_SOH_3664;I calmly explain to the woman that I am just another pilgrim and that this is the best route for me, and she listens to my words before offering me what appears to be a sincere apology. Though there are many that would have resorted to violence or that would have returned the insults I feel that approaching the matter with patience was correct.;;;;;;;;;;;;;x
EVTOPTA_SOH_3664;Patience is the right path!;;;;;;;;;;;;;x
EVTDESC_SOH_3665;I calmly explain to the woman that I am just another pilgrim and that this is the best route for me, and she listens to my words before offering me what appears to be a sincere apology. Though I usually would have expected a better apology, I am on a pilgrimage to better myself, and I decide to put my pride aside.;;;;;;;;;;;;;x
EVTOPTA_SOH_3665;I should be humber!;;;;;;;;;;;;;x
EVTDESC_SOH_3666;I calmly explain to the woman that I am just another pilgrim and that this is the best route for me, and she listens to my words before offering me what appears to be a sincere apology. There are those that would not have considered a mere apology acceptable after their pride was injured, but I can see how being humble is the right decision.;;;;;;;;;;;;;x
