EVTDESC_SOH_3728;After visiting a few of the shrines along the Kumano route I have noticed that the number of pilgrims on the road is much smaller than it was closer to the start of the route. Evidently, not everyone bothers to visit every shrine around the pilgrim route, and I have started to wonder if I perhaps should cut the pilgrimage short as well.;;;;;;;;;;;;;x
EVTOPTA_SOH_3728;I can stop now...;;;;;;;;;;;;;x
EVTOPTB_SOH_3728;I can't stop early!;;;;;;;;;;;;;x
EVTDESC_SOH_3729;I decide to skip as many shrines as I can get away with and take a look at a map, noticing that there are various possible shortcuts that I can make good use of. Over the next few days I start to fell that I made the right decision, and decide that working hard is not right for me after all. From now on, I want to take it easy.;;;;;;;;;;;;;x
EVTOPTA_SOH_3729;I should take it easy...;;;;;;;;;;;;;x
EVTDESC_SOH_3730;I decide to skip as many shrines as I can get away with and take a look at a map, noticing that there are various possible shortcuts that I can make good use of. I spend the next couple of days reflecting on how much I tend to work, and I conclude that I really should learn to relax more.;;;;;;;;;;;;;x
EVTOPTA_SOH_3730;I can't work all the time...;;;;;;;;;;;;;x
EVTDESC_SOH_3731;I decide to skip as many shrines as I can get away with and take a look at a map, noticing that there are various possible shortcuts that I can make good use of. As I walk along the much shorter route I decide that I have made the right choice as I really do not feel that there is much to be gained from faith.;;;;;;;;;;;;;x
EVTOPTA_SOH_3731;Faith has its limits!;;;;;;;;;;;;;x
EVTDESC_SOH_3732;I decide to skip as many shrines as I can get away with and take a look at a map, noticing that there are various possible shortcuts that I can make good use of. I have not really considered myself a strong believer of the [Root.Religion.GetName] faith at any point, and when I consider things a bit more I conclude that it simply is not important.;;;;;;;;;;;;;x
EVTOPTA_SOH_3732;The kami are irrelevant!;;;;;;;;;;;;;x
EVTDESC_SOH_3733;I decide to skip as many shrines as I can get away with and take a look at a map, noticing that there are various possible shortcuts that I can make good use of. A few hours later, when my path briefly intersects with the actual pilgrim route, I come face to face with a priestess who sees fit to berate me for not taking the proper route.;;;;;;;;;;;;;x
EVTOPTA_SOH_3733;Oh, shut up!;;;;;;;;;;;;;x
EVTDESC_SOH_3734;I decide to skip as many shrines as I can get away with and take a look at a map, noticing that there are various possible shortcuts that I can make good use of. The journey is largely uneventful, and I feel that it was the right decision to take the shorter route as nobody seems to mind that I did.;;;;;;;;;;;;;x
EVTOPTA_SOH_3734;I knew I could stop early!;;;;;;;;;;;;;x
EVTDESC_SOH_3735;I decide against ending the pilgrimage early and continue along the main route, spending some time at every shrine I come across. As I do, I consider various times in the past when I have been less diligent and how I often have ended up regretting this, and I resolve to improve in that regard in the future.;;;;;;;;;;;;;x
EVTOPTA_SOH_3735;Hard work pays off!;;;;;;;;;;;;;x
EVTDESC_SOH_3736;I decide against ending the pilgrimage early and continue along the main route, spending some time at every shrine I come across. I reflect on the fact that I in the past would have chosen the easier route as that would have required less effort on my part, and I decide that those days are behind me.;;;;;;;;;;;;;x
EVTOPTA_SOH_3736;I can't afford to rest!;;;;;;;;;;;;;x
EVTDESC_SOH_3737;I decide against ending the pilgrimage early and continue along the main route, spending some time at every shrine I come across. Once, I would have found doing such a thing quite wasteful as I was unsure whether the kami were real or not, but over the course of my journey I have reconsidered.;;;;;;;;;;;;;x
EVTOPTA_SOH_3737;I no longer lack faith!;;;;;;;;;;;;;x
EVTDESC_SOH_3738;I decide against ending the pilgrimage early and continue along the main route, spending some time at every shrine I come across. I have always had faith in the kami and the teachings of the [Root.Religion.GetName] faith, and as I visit the shrines and listen to the priests and priestesses there my faith only becomes stronger.;;;;;;;;;;;;;x
EVTOPTA_SOH_3738;My faith has never been stronger!;;;;;;;;;;;;;x
EVTDESC_SOH_3739;I decide against ending the pilgrimage early and continue along the main route, spending some time at every shrine I come across. Once, I would have found such a journey rather difficult, but the long journey to the start of the Kumano route and the journey along the route has made me stronger than before.;;;;;;;;;;;;;x
EVTOPTA_SOH_3739;I am not so weak now...;;;;;;;;;;;;;x
EVTDESC_SOH_3740;I decide against ending the pilgrimage early and continue along the main route, spending some time at every shrine I come across. Though I have never been what anyone really would consider weak, I am noticing that I feel less and less tired at the end of every day. Evidently, the journey has paid off.;;;;;;;;;;;;;x
EVTOPTA_SOH_3740;I feel stronger!;;;;;;;;;;;;;x
EVTDESC_SOH_3741;I decide against ending the pilgrimage early and continue along the main route, spending some time at every shrine I come across. At one of these shrines I come across a priestess that fancies herself a scholar on both religious and mundane matters, and she is more than willing to share a few insights with me.;;;;;;;;;;;;;x
EVTOPTA_SOH_3741;This will be useful!;;;;;;;;;;;;;x
EVTDESC_SOH_3742;I decide against ending the pilgrimage early and continue along the main route, spending some time at every shrine I come across. The priests and priestesses found there are quite pleased to learn that I have not skipped any of the shrines, and they tell me that it is most definitely something that sets me apart from many pilgrims.;;;;;;;;;;;;;x
EVTOPTA_SOH_3742;I did the right thing!;;;;;;;;;;;;;x
EVTDESC_SOH_3743;I decide against ending the pilgrimage early and continue along the main route, spending some time at every shrine I come across. Along the road I come across an old warrior who offers to teach me some of what he knows so that I know how to defend yourself if I should happen to be beset by bandits or the like, and I see no reason to refuse.;;;;;;;;;;;;;x
EVTOPTA_SOH_3743;He was most helpful!;;;;;;;;;;;;;x
EVTDESC_SOH_3744;I decide against ending the pilgrimage early and continue along the main route, spending some time at every shrine I come across. The journey is largely uneventful, and though it is not over quickly I do not really regret spending more time on my pilgrimage as the route I followed was quite scenic at times.;;;;;;;;;;;;;x
EVTOPTA_SOH_3744;It has been enjoyable!;;;;;;;;;;;;;x
EVTDESC_SOH_3745;As I reach the end of the Kumano route I know that it is time for me to head home. Even though there are things I could do away from home that might be of interest, there is doubtlessly a lot of work waiting for me back at [Root.Capital.GetName], and it would be good to deal with it sooner rather than later.;;;;;;;;;;;;;x
EVTOPTA_SOH_3745;I must head home!;;;;;;;;;;;;;x
EVTTITLE_SOH_3746;Ise Grand Shrine;;;;;;;;;;;;;x
EVTDESC_SOH_3746;At last I have arrived at Ise, the site of the ancient and massive shrine complex known as Ise Grand Shrine, which primarily is dedicated to Amaterasu-Omikami, the great august kami who shines in the heaven. It is one of the holiest and most important sites of the Shinto religion, and I am far from the only pilgrim present.\nThough parts of the shrine complex are not open to most pilgrims I am confident that I am considered important enough to be permitted to visit nearly any location I might wish, which might be something I want to take advantage of.;;;;;;;;;;;;;x
EVTOPTA_SOH_3746;Praise the Sun Goddess!;;;;;;;;;;;;;x
EVTDESC_SOH_3747;As I am walking around near the main shrine at Ise a young priestess approaches me to inform me that the Saio, the head priestess of Ise and a member of the Imperial Family, has heard of my arrival and wishes to speak with me if I can find the time. I am free to refuse, of course, but it would probably upset the Saio, and possibly her relatives.;;;;;;;;;;;;;x
EVTOPTA_SOH_3747;I will meet with her!;;;;;;;;;;;;;x
EVTOPTB_SOH_3747;I don't think so!;;;;;;;;;;;;;x
EVTDESC_SOH_3748;The Saio, [the_saio.GetBestName], looks pleased when I am led into her presence, and she welcomes me to Ise in both her own name and the name of Amaterasu. She indicates that she has set aside some time for me, and it is clear from the way she phrases it that it is up to me what I want to attempt to accomplish during this time.;;;;;;;;;;;;;x
EVTOPTA_SOH_3748;I want to seduce her!;;;;;;;;;;;;;x
EVTOPTB_SOH_3748;I want to befriend her!;;;;;;;;;;;;;x
EVTOPTC_SOH_3748;I want Amaterasu's blessing!;;;;;;;;;;;;;x
EVTDESC_SOH_3749;During my meeting with [From.GetBestName], a pilgrim that has come to the Ise Grand Shrine, I graciously tell [From.GetHerHim] that [From.GetSheHe] can suggest a topic of conversation. To my surprise, [From.GetBestName] suggests that [From.GetSheHe] and I should stop talking and head somewhere more private to engage in more intomate activities.;;;;;;;;;;;;;x
EVTOPTA_SOH_3749;Oh, that sounds lovely!;;;;;;;;;;;;;x
EVTOPTB_SOH_3749;I don't think so!;;;;;;;;;;;;;x
EVTOPTC_SOH_3749;Me and you? NEVER!;;;;;;;;;;;;;x
EVTDESC_SOH_3750;The Saio, [From.GetBestName], is quite receptive to my attempt to seduce her, and since she is in charge of Ise it is not a problem for her to ensure that the two of us are left alone so that we can get to know one another much more intimately. It would be bad if word got out, but hopefully it will not.;;;;;;;;;;;;;x
EVTOPTA_SOH_3750;THat went well!;;;;;;;;;;;;;x
EVTDESC_SOH_3751;A messenger arrived from Ise today, bringing a letter from one of the lesser priestesses there. According to this letter, the Saio, [From.GetBestName], the head priestess of Ise, is not as celibate as she is supposed to be. Though the letter does not provide any proof, it is doubtful that the priestess is lying.;;;;;;;;;;;;;x
EVTOPTA_SOH_3751;The Saio has shamed us all!;;;;;;;;;;;;;x
EVTDESC_SOH_3752;Some days after [FromFromFrom.GetBestName]'s visit I start hearing rumors suggesting that I have broken your vow of celibacy. It is unknown who started the rumors, and they do not seem to contain any mention of the identity of my new lover, but it is probably only a matter of time before [From.GetBestName] learns of it..;;;;;;;;;;;;;x
EVTOPTA_SOH_3752;I should have been more discreet...;;;;;;;;;;;;;x
EVTDESC_SOH_3753;The Saio is displeased by my attempt at seduction and tells me in no uncertain terms that she will not betray her vow of celibacy. She suggests that I should leave her presence at once, and that I should reconsider my behavior as Amaterasu does not look kindly on pilgrims that behave improperly during a pilgrimage.;;;;;;;;;;;;;x
EVTOPTA_SOH_3753;Oh, well...;;;;;;;;;;;;;x
EVTDESC_SOH_3754;The Saio is displeased by my attempt at seduction and tells me in no uncertain terms that she will not betray her vow of celibacy. She further informs me that she would not consider sleeping with me even if she had not made any such vow. She orders me to leave her presence at once.;;;;;;;;;;;;;x
EVTOPTA_SOH_3754;That went poorly...;;;;;;;;;;;;;x
EVTDESC_SOH_3755;I tell the Saio, [the_saio.GetBestName], that I wish to get to know her better, and she is willing to converse with me on a number of different subjects in order to make that possible. It turns out that the two of us have a lot in common, and that we enjoy each other's company. By the time I depart we have become close friends.;;;;;;;;;;;;;x
EVTOPTA_SOH_3755;Best friends forever!;;;;;;;;;;;;;x
EVTDESC_SOH_3756;During my meeting with [From.GetBestName], a pilgrim that has come to the Ise Grand Shrine, I graciously tell [From.GetHerHim] that [From.GetSheHe] can suggest a topic of conversation once the initial pleasantries are over. [From.GetSheHeCap] says that [From.GetSheHe] would like to get to know me better, and we turn out to have a lot in common..;;;;;;;;;;;;;x
EVTOPTA_SOH_3756;I made a new friend!;;;;;;;;;;;;;x
EVTDESC_SOH_3757;I tell the Saio, [the_saio.GetBestName], that I wish to get to know her better, and she is willing to converse with me on a number of different subjects in order to make that possible. Unfortunate, it turns out that the two of us have nothing in common, and that neither of us enjoy the conversation. She quickly orders me to leave her presence..;;;;;;;;;;;;;x
EVTOPTA_SOH_3757;That didn't go well...;;;;;;;;;;;;;x
EVTDESC_SOH_3758;During my meeting with [From.GetBestName], a pilgrim that has come to the Ise Grand Shrine, I graciously tell [From.GetHerHim] that [From.GetSheHe] can suggest a topic of conversation once the initial pleasantries are over. [From.GetSheHeCap] says that [From.GetSheHe] would like to get to know me better. Sadly, nothing I learn about [From.GetHerHim] is to my liking.;;;;;;;;;;;;;x
EVTOPTA_SOH_3758;I don't like [From.GetHerHim]!;;;;;;;;;;;;;x
EVTDESC_SOH_3759;During my meeting with [From.GetBestName], a pilgrim that has come to the Ise Grand Shrine, I graciously tell [From.GetHerHim] that [From.GetSheHe] can suggest a topic of conversation once the initial pleasantries are over. [From.GetSheHeCap] tells me that [From.GetSheHe] wishes for me to bless [From.GetHerHim] in the name of Amaterasu.;;;;;;;;;;;;;x
EVTOPTA_SOH_3759;A blessing? Sure!;;;;;;;;;;;;;x
EVTOPTB_SOH_3759;A blessing? Ha!;;;;;;;;;;;;;x
EVTDESC_SOH_3760;I ask the Saio, [the_saio.GetBestName], to bless me in the name of Amaterasu, and after considering my request for a brief moment she tells me that it is not unreasonable and that I shall have my blessing. The two of us converse a while longer, but eventually she needs to attend to other matters and has to ask me to depart.;;;;;;;;;;;;;x
EVTOPTA_SOH_3760;I got what I wanted!;;;;;;;;;;;;;x
EVTDESC_SOH_3761;I ask the Saio, [the_saio.GetBestName], to bless me in the name of Amaterasu, and after considering my request for a brief moment she tells me that it is unreasonable and that I shall not have my blessing. I feel that perhaps I could change her mind, given enough time, but she asks me to leave her presence at once.;;;;;;;;;;;;;x
EVTOPTA_SOH_3761;That didn't work...;;;;;;;;;;;;;x
EVTDESC_SOH_3763;I have encountered many other pilgrims at Ise Grand Shrine and also many priests and priestesses serving both Amaterasu-Omikami herself and various other kami, and this has made me reflect on the Shinto faith. Once, I might have had my doubts, but those days are behind me as I feel that the pilgrimage only has made my faith stronger.;;;;;;;;;;;;;x
EVTOPTA_SOH_3763;Amaterasu watches over us all!;;;;;;;;;;;;;x
EVTDESC_SOH_3764;I have encountered many other pilgrims at Ise Grand Shrine and also many priests and priestesses serving both Amaterasu-Omikami herself and various other kami, and this has made me reflect on the Shinto faith. Once, I might have had faith in the kami, but those days are behind me as I feel that the pilgrimage only has made ny faith weaker.;;;;;;;;;;;;;x
EVTOPTA_SOH_3764;Amaterasu is nothing!;;;;;;;;;;;;;x
EVTDESC_SOH_3765;As I am walking around outside the main shrine at Ise I feel a sudden flash of inspiration, and many glorious truths are at once clear to me. I need to share these truths with those around me, and I feel that writing down the message on the walls of the shrine is the best way to accomplish this, even though many of the onlookers try to dissuade me.;;;;;;;;;;;;;x
EVTOPTA_SOH_3765;AMATERASU SPEAKS TO ME!;;;;;;;;;;;;;x
EVTDESC_SOH_3766;A young priestess comes running into me presence to inform me that [From.GetBestName], a pilgrim visiting Ise, has started writing down various unholy messages on the walls of the shrine, claiming that [From.GetSheHe] is revealing truths that come directly from Amaterasu herself. The priestess asks me what I want to do about the matter.;;;;;;;;;;;;;x
EVTOPTA_SOH_3766;Imprison this mad[From.GetManWoman]!;;;;;;;;;;;;;x
EVTOPTB_SOH_3766;Get [From.GetHerHim] out of here!;;;;;;;;;;;;;x
EVTOPTC_SOH_3766;Just have someone clean it up!;;;;;;;;;;;;;x
EVTOPTD_SOH_3766;AMATERASU SPEAKS TO [From.GetHerHimFullCaps]!;;;;;;;;;;;;;x
EVTDESC_SOH_3767;I am in the middle of writing down the glorious truths Amaterasu have revealed to me and fail to pay attention to my surroundings, which means I do not notice the guards before they are upon me. They seize me and drag me away, ignoring my demands to be released, and before long they drag me into a cell and lock me inside.;;;;;;;;;;;;;x
EVTOPTA_SOH_3767;Amaterasu didn't mention this...;;;;;;;;;;;;;x
EVTDESC_SOH_3768;I am in the middle of writing down the glorious truths Amaterasu have revealed to me and fail to pay attention to my surroundings, which means I do not notice the guards before they are upon me. They seize me and drag me away, ignoring my demands to be released, and before long they have dragged me to the outskirts of Ise and told me to go away.;;;;;;;;;;;;;x
EVTOPTA_SOH_3768;How rude!;;;;;;;;;;;;;x
EVTDESC_SOH_3769;I finish writing the most holy message from Amaterasu on the walls of the shrine and move away from it, satisfied with my work. As I leave, I notice that a number of priests and priestesses come running and start cleaning away the words that I wrote. I see no reason to rewrite them at this time, as I can share the message elsewhere.;;;;;;;;;;;;;x
EVTOPTA_SOH_3769;THE TRUTH WILL NOT BE CONCEALED!;;;;;;;;;;;;;x
EVTDESC_SOH_3770;The crowd surrounding me goes silent as a young priestess comes running, and though I initially think that she is there to try to stop me from sharing the glorious truths that Amaterasu revealed to me it turns out that she has brought a message from the Saio that tells the crowd to heed my words as they clearly come from Amaterasu herself.;;;;;;;;;;;;;x
EVTOPTA_SOH_3770;AMATERASU SPEAKS TO ME!;;;;;;;;;;;;;x
EVTDESC_SOH_3771;My visit to Ise has been rather pleasant, and I am not sure that I have seen everything of note there, but it is time for me to take my leave. Doubtlessly, there are many things back at [Root.Capital.GetName] that require my attention already, and delaying my return would therefore be rather unwise.;;;;;;;;;;;;;x
EVTOPTA_SOH_3771;Time to go home!;;;;;;;;;;;;;x
EVTTITLE_SOH_3772;The Holy Mountain;;;;;;;;;;;;;x
EVTDESC_SOH_3772;For some time now, the iconic shape of Mount Fuji, my destination and one of the Three Holy Mountains, has been visible at the horizon, steadily growing larger, and now I have finally arrived at its base.\nI can see plenty of other pilgrims around, as well as priests and priestesses maintaining the many [Root.Religion.GetName] shrines surrounding the mountain. They all appear to be absorbed in their own thoughts at the moment, and pay little attention to me.\nWhile I knew some of what to expect from the many depictions of the mountain that I have seen in the past, it is definitely a sight worth seeing in person.;;;;;;;;;;;;;x
EVTOPTA_SOH_3772;It is quite impressive!;;;;;;;;;;;;;x
EVTDESC_SOH_3773;There are several pilgrim routes circling Mount Fuji, and also a number that appear to permit me to ascend all the way to the summit. Though the journey to the summit might be difficult, and perhaps even somewhat dangerous, people would likely think more highly of me if I ascended the mountain, but it is ultimately up to me.;;;;;;;;;;;;;x
EVTOPTA_SOH_3773;I must climb the mountain!;;;;;;;;;;;;;x
EVTOPTB_SOH_3773;I don't need to climb it...;;;;;;;;;;;;;x
EVTDESC_SOH_3774;I head up along one of the pilgrim routes leading to the summit of Mount Fuji, finding the going rather difficult as the path is both narrow and steep in several places. Partway up the side of the mountain I accidentally cause a small rockslide, and though I manage to avoid the worst of it some of the smaller rocks still hit me.;;;;;;;;;;;;;x
EVTOPTA_SOH_3774;Ow!;;;;;;;;;;;;;x
EVTDESC_SOH_3775;I head up along one of the pilgrim routes leading to the summit of Mount Fuji, finding the going rather difficult as the path is both narrow and steep in several places. However, I press on, and eventually find the going easier and easier despite the route not becoming more forgiving. It seems my pilgrimage has paid off.;;;;;;;;;;;;;x
EVTOPTA_SOH_3775;I am not so weak now...;;;;;;;;;;;;;x
EVTDESC_SOH_3776;I head up along one of the pilgrim routes leading to the summit of Mount Fuji, finding the going rather difficult as the path is both narrow and steep in several places. Pressing on, I find strength within me that I did not think I had, and the going becomes more and more manageable even though the route hardly becomes more forgiving.;;;;;;;;;;;;;x
EVTOPTA_SOH_3776;I feel stronger!;;;;;;;;;;;;;x
EVTDESC_SOH_3777;I head up along one of the pilgrim routes leading to the summit of Mount Fuji, finding the going rather difficult as the path is both narrow and steep in several places. Once, the prospect of such a climb would have been too daunting to contemplate, but I am a changed [Root.GetManWoman] as a result of my pilgrimage, and I press on.;;;;;;;;;;;;;x
EVTOPTA_SOH_3777;I can't afford to relax!;;;;;;;;;;;;;x
EVTDESC_SOH_3778;I head up along one of the pilgrim routes leading to the summit of Mount Fuji, finding the going rather difficult as the path is both narrow and steep in several places. I am no stranger to having to work hard to achieve what I want to achieve, however, and I refuse to consider giving up on the climb.;;;;;;;;;;;;;x
EVTOPTA_SOH_3778;I must press on!;;;;;;;;;;;;;x
EVTDESC_SOH_3779;I head up along one of the pilgrim routes leading to the summit of Mount Fuji, finding the going rather difficult as the path is both narrow and steep in several places. Even so, the journey is not entirely unpleasant, and it is also rather uneventful, and though it takes a while I make good progress towards the summit.;;;;;;;;;;;;;x
EVTOPTA_SOH_3779;Onwards!;;;;;;;;;;;;;x
EVTDESC_SOH_3781;It takes me some time, but eventually I manage to ascend all the way to the summit of Mount Fuji. The view from the mountain is quite nice, and I feel that I never would have gotten to see it if I had not put my faith in the [Root.Religion.GetName] religion and the kami, seeing as I never would have made a pilgrimage if that was not the case.;;;;;;;;;;;;;x
EVTOPTA_SOH_3781;My faith is strong!;;;;;;;;;;;;;x
EVTDESC_SOH_3782;It takes me some time, but eventually I manage to ascend all the way to the summit of Mount Fuji. The journey has been exhausting, and I do not find the view to be as pleasant as I had been led to believe, and given how disappointing it has been I start to wonder whether the whole pilgrimage has been a waste of my time.;;;;;;;;;;;;;x
EVTOPTA_SOH_3782;I had expected far better!;;;;;;;;;;;;;x
EVTDESC_SOH_3783;It takes me some time, but eventually I manage to ascend all the way to the summit of Mount Fuji. Looking down on the land below, I do not feel that the experience has brought me closer to the kami or has given me any more insights into the [Root.Religion.GetName] faith, but I cannot deny that the climb still was worth it.;;;;;;;;;;;;;x
EVTOPTA_SOH_3783;The view is quite good!;;;;;;;;;;;;;x
EVTDESC_SOH_3785;I decide to head along one of the less travelled pilgrimage routes circling Mount Fuji and make sure to stop at the shrines I come across to pay my respect to the kami there. The priests and priestesses tending to the shrines are quite welcoming, and they make me feel rather more confident about the teachings of the [Root.Religion.GetName] faith with their words.;;;;;;;;;;;;;x
EVTOPTA_SOH_3785;My faith is strong!;;;;;;;;;;;;;x
EVTDESC_SOH_3786;I decide to head along one of the less travelled pilgrimage routes circling Mount Fuji and make sure to stop at the shrines I come across to pay my respect to the kami there. Several of the priests and priestesses there express their disappointment in the fact that I decided not to climb the mountain, and I had expected far better from them.;;;;;;;;;;;;;x
EVTOPTA_SOH_3786;This was a waste of time!;;;;;;;;;;;;;x
EVTDESC_SOH_3787;I decide to head along one of the less travelled pilgrimage routes circling Mount Fuji and make sure to stop at the shrines I come across to pay my respect to the kami there. I speak a little with some of the other pilgrims I come across, and hear a few interestingt things, but on the whole it is an uneventful experience.;;;;;;;;;;;;;x
EVTOPTA_SOH_3787;I guess it was a nice walk...;;;;;;;;;;;;;x
EVTDESC_SOH_3789;After another pilgrim mentions that there is a short pilgrimage route leading through a forest to the northwest of Mount Fuji I decide that I will take a short walk along this route before returning home. As I wander through this forest I feel something brush right past me, and I suddenly remember that the pilgrim warned me that the path might be haunted.;;;;;;;;;;;;;x
EVTOPTA_SOH_3789;Was that a ghost?;;;;;;;;;;;;;x
EVTDESC_SOH_3790;I sometimes get flashes of insight that others do not get, and as I am preparing to leave Mount Fuji I get the feeling that I must walk to the northwest. I do, entering the forest located there while wondering what I might find inside. Suddently, yet another insight comes to me, and I realize that the spirits of the dead are everywhere around me.;;;;;;;;;;;;;x
EVTOPTA_SOH_3790;Get away from me!;;;;;;;;;;;;;x
EVTDESC_SOH_3791;I decide to take a walk along a pilgrimage route leading to the northwest from Mount Fuji because the forest I can see in that direction looks quite strange. Entering the forest, I feel something strange in the air all around me, and before long I can see the spirits of the dead appear in every direction, watching my every move with interest.;;;;;;;;;;;;;x
EVTOPTA_SOH_3791;Get away from me!;;;;;;;;;;;;;x
