EVTOPTA_SOH_3666;Humility is the right path!;;;;;;;;;;;;;x
EVTDESC_SOH_3667;I calmly explain to the woman that I am just another pilgrim and that this is the best route for me, and she listens to my words before offering me what appears to be a sincere apology. Though I was rather less insistent than I usually would have been, it clearly worked out in mu favor, and I conclude that I should be less stubborn in general.;;;;;;;;;;;;;x
EVTOPTA_SOH_3667;Stubborness is overrated!;;;;;;;;;;;;;x
EVTDESC_SOH_3668;I calmly explain to the woman that I am just another pilgrim and that this is the best route for me, and she listens to my words before offering me what appears to be a sincere apology. Over the next few days I look back at some other incidents in the past and start seeing how I could have handled them more diplomatically.;;;;;;;;;;;;;x
EVTOPTA_SOH_3668;I know what to say now!;;;;;;;;;;;;;x
EVTDESC_SOH_3669;I calmly explain to the woman that I am just another pilgrim and that this is the best route for me, and though she calms down a bit she tells me that she prefers solitude even so, conceding that she could be the one to take a different route. True to her words, she elects to head off in a different direction almost immediately.;;;;;;;;;;;;;x
EVTOPTA_SOH_3669;Perhaps it is for the best...;;;;;;;;;;;;;x
EVTDESC_SOH_3670;Before setting off on my pilgrimage you made the customary donations to nearby temples to prove my devotion, but even so I brought quite a bit of money on my journey. Recently, I have been considering the fact that this is not quite in line with what is expected of me during a pilgrimage, and perhaps I should make another donation.;;;;;;;;;;;;;x
EVTOPTA_SOH_3670;I can give a bit more to charity...;;;;;;;;;;;;;x
EVTOPTB_SOH_3670;I have given more than enough!;;;;;;;;;;;;;x
EVTDESC_SOH_3671;I make sure to stop by the next temple I come across to hand over a substantial amount of money to the [Root.Religion.GetName] priests found there. They are quite grateful to receive such a donation, and tell me that it is good that I saw fit to donate to charity.;;;;;;;;;;;;;x
EVTOPTA_SOH_3671;I only did what was right!;;;;;;;;;;;;;x
EVTDESC_SOH_3672;I make sure to stop by the next temple I come across to hand over a substantial amount of money to the [Root.Religion.GetName] priests found there. After leaving I start considering just how much money I normally have been earning compared to how much I have been able to spend, and I conclude that I really do not need that much money.;;;;;;;;;;;;;x
EVTOPTA_SOH_3672;Greed is overrated!;;;;;;;;;;;;;x
EVTDESC_SOH_3673;I make sure to stop by the next temple I come across to hand over a substantial amount of money to the [Root.Religion.GetName] priests found there. Later on I start considering whether I could donate to temples more often, and conclude that it should be rather easy to arrange that as I have more than enough money.;;;;;;;;;;;;;x
EVTOPTA_SOH_3673;Charity is the right path!;;;;;;;;;;;;;x
EVTDESC_SOH_3674;I make sure to stop by the next temple I come across to hand over a substantial amount of money to the [Root.Religion.GetName] priests found there. Normally, I would consider doing so a bit beneath me, but I have decided that I should better myself during my pilgrimage and that becoming more humble is the right move.;;;;;;;;;;;;;x
EVTOPTA_SOH_3674;Pride is a problem!;;;;;;;;;;;;;x
EVTDESC_SOH_3675;I make sure to stop by the next temple I come across to hand over a substantial amount of money to the [Root.Religion.GetName] priests found there. They are a bit surprised to learn that I was willing to set my own good aside, but they praise me for being humble enough to admit that I had made a mistake.;;;;;;;;;;;;;x
EVTOPTA_SOH_3675;I don't mind being humble!;;;;;;;;;;;;;x
EVTDESC_SOH_3676;I make sure to stop by the next temple I come across to hand over a substantial amount of money to the [Root.Religion.GetName] priests found there. They praise ,e for my kindness, and I take their words to heart and decide that from now on I should endeavor to be kind more often than I have been in the past.;;;;;;;;;;;;;x
EVTOPTA_SOH_3676;I should be kind more often!;;;;;;;;;;;;;x
EVTDESC_SOH_3677;I make sure to stop by the next temple I come across to hand over a substantial amount of money to the [Root.Religion.GetName] priests found there, and then leave the temple right away. I have yet to reach my destination, after all, and cannot afford to be distracted by minor things along the road.;;;;;;;;;;;;;x
EVTOPTA_SOH_3677;Onwards!;;;;;;;;;;;;;x
EVTDESC_SOH_3678;I am in the middle of a discussion with a [Root.Religion.GetName] priest at a small shrine when I suddenly notice that the sun is lower on the horizon than I had thought it was. Since I am supposed to make sure that I get to my inn before dark during a pilgrimage, I might need to leave sooner rather than later, even though the priest might be upset.;;;;;;;;;;;;;x
EVTOPTA_SOH_3678;I must depart at once!;;;;;;;;;;;;;x
EVTOPTB_SOH_3678;I can stay a while and listen...;;;;;;;;;;;;;x
EVTDESC_SOH_3679;The priest is surprised at first when I interrupt him to tell him that I need to leave at once, but then he notices just how low the sun is on the horizon and tells me that he is sorry to have taken up so much of my time. Furthermore, he says that it is rather refreshing to meet a pilgrim that actually cares about adhering to the rules for a pilgrimage.;;;;;;;;;;;;;x
EVTOPTA_SOH_3679;I knew he'd understand!;;;;;;;;;;;;;x
EVTDESC_SOH_3680;I take my leave and hurry away from the temple, doing my best to make up for lost time. Though I normally would have taken it easy I have come to the conclusion that that is not what I really want to do, and I resolve to become less slothful in order to better myself during my pilgrimage.;;;;;;;;;;;;;x
EVTOPTA_SOH_3680;I cannot afford to rest!;;;;;;;;;;;;;x
EVTDESC_SOH_3681;I take my leave and hurry away from the temple, doing my best to make up for lost time. I am no stranger to working hard at times when something unexpected happens, and as I hurry towards the next village I decide that I should make an effort to always work hard from now on to try to have more time available for unforeseen issues that might arise.;;;;;;;;;;;;;x
EVTOPTA_SOH_3681;I must work hard to succeed!;;;;;;;;;;;;;x
EVTDESC_SOH_3682;The priest is surprised when I interrupt him and to tell him that I need to leave at once. When I tell him that it is getting late and that I need to hurry if I am to reach the next village with an inn before dark he gets annoyed and tells me that I should not have stopped in the first place if I did not think to plan ahead.;;;;;;;;;;;;;x
EVTOPTA_SOH_3682;I would have thought he'd be pleased...;;;;;;;;;;;;;x
EVTDESC_SOH_3683;I stay at the temple until the priest finally is done talking, at which point the sun barely is above the horizon. I am unsure whether I could reach the nearest village with an inn before dark even if I really make an effort, and I decide that it is not really worth trying and that there is nothing wrong with taking it easy.;;;;;;;;;;;;;x
EVTOPTA_SOH_3683;I can afford to relax...;;;;;;;;;;;;;x
EVTDESC_SOH_3684;I stay at the temple until the priest finally is done talking, at which point the sun barely is above the horizon. Though I perhaps could have made it to the nearest village with an inn before dark if I had made an effort Iu decide that it really is not worth trying, and as I head off at a rather slow pace I decide that I need to learn to relax.;;;;;;;;;;;;;x
EVTOPTA_SOH_3684;I can't work all the time...;;;;;;;;;;;;;x
EVTDESC_SOH_3685;The priest keeps talking for a good while and it is almost dark before he finally stops. As I prepare to leave he takes the time to tell me that I really should have been more mindful of the fact that I needed to depart sooner. It is rather clear that he does not seem to think that the fact that he kept talking was why I remained at the temple.;;;;;;;;;;;;;x
EVTOPTA_SOH_3685;But I didn't want to upset you!;;;;;;;;;;;;;x
EVTDESC_SOH_3686;The priest keeps talking for a good while and it is almost dark before he finally stops. He is evidently aware of the fact that this makes it unlikely that I will reach an inn before dark as he makes sure to tell me that I need not worry about that as keeping him company and listening to him without interruption certainly justifies being out after dark.;;;;;;;;;;;;;x
EVTOPTA_SOH_3686;Good to hear!;;;;;;;;;;;;;x
EVTDESC_SOH_3687;It is almost dark before the priest stops talking long enough for me to leave, and I find myself racing the sunset as I hurry towards where I think that the nearest inn is located. Twilight has arrived by the time that I enter the inn, but twilight is not the same as darkness, so I managed to get there in time.;;;;;;;;;;;;;x
EVTOPTA_SOH_3687;I barely made it...;;;;;;;;;;;;;x
EVTDESC_SOH_3688;I wake up well before dawn one morning and cannot fall asleep again, and I start to wonder whether it would be a good idea to set off early so that I perhaps might reach my destination sooner. I know that I technically am not supposed to leave my inn during the night during a pilgrimage unless it is unavoidable, but perhaps there are expections?;;;;;;;;;;;;;x
EVTOPTA_SOH_3688;An early start is right!;;;;;;;;;;;;;x
EVTOPTB_SOH_3688;There are rules to follow...;;;;;;;;;;;;;x
EVTDESC_SOH_3689;I head down to the common room and eat a quick breakfast before gathering my belongings and setting off from the inn. As I depart I consider the fact that I normally would have been willing to wait patiently for things to happen, but it has at times been rather difficult, and I do not really feel that it is something I want keep doing.;;;;;;;;;;;;;x
EVTOPTA_SOH_3689;Maybe I'm a bit impatient...;;;;;;;;;;;;;x
EVTDESC_SOH_3690;I head down to the common room and eat a quick breakfast before gathering my belongings and setting off from the inn. I am no stranger to not resting when there is something to do, and looking back I can see how being a bit more diligent would have been beneficial. Since I am on a pilgrimage partially to better myself, I resolve to become more diligent from now on.;;;;;;;;;;;;;x
EVTOPTA_SOH_3690;I must not waste time!;;;;;;;;;;;;;x
EVTDESC_SOH_3691;I head down to the common room and eat a quick breakfast before gathering my belongings and setting off from the inn. Normally, I would have welcomed any excuse to take it easy, but I have started to come to the conclusion that that is often detrimental, and I resolve to be less slothful in the future.;;;;;;;;;;;;;x
EVTOPTA_SOH_3691;I must work harder!;;;;;;;;;;;;;x
EVTDESC_SOH_3692;I head down to the common room and eat a quick breakfast before gathering my belongings and heading for the door. As I am about to step outside another pilgrim that has been staying at the same inn comes down the stairs and spots me, and she quickly calls me out on leaving an inn during the night.;;;;;;;;;;;;;x
EVTOPTA_SOH_3692;I can't please everyone...;;;;;;;;;;;;;x
EVTDESC_SOH_3693;I head down to the common room and eat a quick breakfast before gathering my belongings and setting off from the inn. I have quite far to travel before I reach my destination, and I cannot affort to waste time, and since nobody seems to have noticed that I am breaking the rules it probably will not be anything I come to regret.;;;;;;;;;;;;;x
EVTOPTA_SOH_3693;Onwards!;;;;;;;;;;;;;x
EVTDESC_SOH_3694;I decide that I should remain at the inn until dawn, as is expected of me. I spend the time reflecting on the fact that there are many things in life that I cannot control, and that that sometimes mean I have to wait on things, and I resolve to be a bit more patient moving forward.;;;;;;;;;;;;;x
EVTOPTA_SOH_3694;Good things come to those that wait!;;;;;;;;;;;;;x
EVTDESC_SOH_3695;I decide that I should remain at the inn until dawn, as is expected of me. As I do not really have anything to do the time is not spent in a productive manner, but I find that I do not mind this as much as I had expected, and I decide that perhaps it would not be a bad idea to take it easy more often.;;;;;;;;;;;;;x
EVTOPTA_SOH_3695;I should not work so hard...;;;;;;;;;;;;;x
EVTDESC_SOH_3696;I decide that I should remain at the inn until dawn, as is expected of me. I do not bother trying to be productive, and even though I initially planned to leave at dawn I find myself lingering at the inn for a while longer after that since I have come to feel that there really is no need to rush.;;;;;;;;;;;;;x
EVTOPTA_SOH_3696;I can relax more often...;;;;;;;;;;;;;x
EVTDESC_SOH_3697;I decide that I should remain at the inn until dawn, as is expected of me. As I hear the other people that have stayed overnight start moving about I head down to eat a quick breakfast, and as the sun is above the horizon after I am done I gather my belongings and set off, seeing as I no longer risk breaking the rules.;;;;;;;;;;;;;x
EVTOPTA_SOH_3697;Onwards!;;;;;;;;;;;;;x
EVTTITLE_SOH_3699;The Chrysanthemum Throne;;;;;;;;;;;;;x
EVTDESC_SOH_3699;After a long journey I have finally arrived at my destination: The court of the [the_tenno.GetTitle].\nThough I have not yet entered the august presence of [the_tenno.GetBestName] [the_tenno.GetHerselfHimself] and thus have not beheld the actual Chrysanthemum Throne I still feel a sense of awe, and judging by the looks on the faces of the other pilgrims I have seen I am not the only one that is impressed.\nAside from briefly being stopped by the guards so that they could confirm my identity and my purpose, none of the locals have really paid attention to me yet.;;;;;;;;;;;;;x
EVTOPTA_SOH_3699;I need to be on my best behavior!;;;;;;;;;;;;;x
EVTDESC_SOH_3700;I could spend weeks or even months wandering the court of the [the_tenno.GetTitle] without getting to see [the_tenno.GetHerHim] or the Chrysanthemum Throne itself, and none would fault me for not bothering [the_tenno.GetHerHim], but I have travelled far and am not just any common pilgrim, so perhaps it would be possible to get an audience.;;;;;;;;;;;;;x
EVTOPTA_SOH_3700;I will try to get an audience!;;;;;;;;;;;;;x
EVTOPTB_SOH_3700;I'd rather not bother [the_tenno.GetHerHim]...;;;;;;;;;;;;;x
EVTDESC_SOH_3701;One of the lesser court officials informs me that [From.GetBestName] has arrived at my court on a pilgrimage and that [From.GetSheHe] is requesting an audience with me. It is unclear if there is a particular reason for this audience or not, and it is not out of line to ask for an audience, but it is up to me wether I want to accept the request or not.;;;;;;;;;;;;;x
EVTOPTA_SOH_3701;I don't have time for this...;;;;;;;;;;;;;x
EVTOPTB_SOH_3701;I can spare the time!;;;;;;;;;;;;;x
EVTOPTC_SOH_3701;We can meet... in the dungeon!;;;;;;;;;;;;;x
EVTDESC_SOH_3702;A messenger arrives to inform me that the [the_tenno.GetTitle] is busy with affairs of state for the time being and cannot spare the time to grant me the audience I seek. The messenger further suggests that it is in everyone's interests for me not to try again later, as the [the_tenno.GetBestName] does not enjoy repeating [the_tenno.GetHerselfHimself].;;;;;;;;;;;;;x
EVTOPTA_SOH_3702;Unfortunate!;;;;;;;;;;;;;x
EVTDESC_SOH_3703;A messenger arrives to inform me that the [the_tenno.GetTitle] has seen fit to grant me the audience I seek. As [the_tenno.GetSheHe] is a bit busy at the moment and was taken by surprise by the request I will have to wait a short while, but I had not expected [the_tenno.GetBestName] to be free at a moment's notice, so this does not really bother me.;;;;;;;;;;;;;x
EVTOPTA_SOH_3703;That's good to hear!;;;;;;;;;;;;;x
EVTDESC_SOH_3704;A messenger arrives to inform me that the [the_tenno.GetTitle] has seen fit to grant me the audience I seek. He tells me to follow him, and as I do so a number of guards fall in all around me. I do not pay much attention to them or where we are going, and consequently I am surprised when the guards lead me to the dungeons and toss me into a cell.;;;;;;;;;;;;;x
EVTOPTA_SOH_3704;It was a trap!;;;;;;;;;;;;;x
EVTDESC_SOH_3705;I am led into the august presence of [the_tenno.GetBestName] [the_tenno.GetHerselfHimself] without much delay. Knowing what is expected of me, I quickly drop to me knees in front of [the_tenno.GetHerHim], but [the_tenno.GetSheHe] quickly tells me to rise and asks if there was anything in particular I wanted to discuss.;;;;;;;;;;;;;x
EVTOPTA_SOH_3705;I am here to express my appreciation!;;;;;;;;;;;;;x
EVTOPTB_SOH_3705;I ask for your blessing!;;;;;;;;;;;;;x
EVTOPTC_SOH_3705;I just wanted to talk to you...;;;;;;;;;;;;;x
EVTDESC_SOH_3706;I inform the [the_tenno.GetBestName] that I wish to express your appreciation for [the_tenno.GetHerHis] rule and [the_tenno.GetHerHim] in person, as it is easier to make it clear that I am being sincere if I do not do it in writing. [the_tenno.GetBestName] considers me words for a moment and then thanks me for my kind words.;;;;;;;;;;;;;x
EVTOPTA_SOH_3706;I think that went well!;;;;;;;;;;;;;x
EVTDESC_SOH_3707;[From.GetBestName] appears before me and falls to [From.GetHerHis] knees, as would be expected, and I bid [From.GetHerHim] to rise and inquire as to why [From.GetSheHe] asked for an audience. [From.GetSheHeCap] tells me that [From.GetSheHe] is there to express [From.GetHerHis] appreciation of me and my rule.;;;;;;;;;;;;;x
EVTOPTA_SOH_3707;I am rather great...;;;;;;;;;;;;;x
EVTDESC_SOH_3708;[From.GetBestName] appears before me and falls to [From.GetHerHis] knees, as would be expected, and I bid [From.GetHerHim] to rise and inquire as to why [From.GetSheHe] asked for an audience. [From.GetSheHeCap] tells me that [From.GetSheHe] is there to ask for my blessing, and that of the kami, on [From.GetHerHim] and [From.GetHerHis] rule.;;;;;;;;;;;;;x
EVTOPTA_SOH_3708;A blessing? Sure!;;;;;;;;;;;;;x
EVTOPTB_SOH_3708;A blessing? Ha!;;;;;;;;;;;;;x
EVTDESC_SOH_3709;[the_tenno.GetBestName] considers my request for a moment before telling me that [the_tenno.GetSheHe] and the kami look favorably on me and my rule and that I definitely am worthy of their blessing. [the_tenno.GetSheHeCap] further tells me that the fact that I saw fit to ask speaks highly of me, as it shows humility.;;;;;;;;;;;;;x
EVTOPTA_SOH_3709;Good to hear!;;;;;;;;;;;;;x
EVTDESC_SOH_3710;[the_tenno.GetBestName] considers my request for a moment before telling me that [the_tenno.GetSheHe] and the kami do not look favorably on me and my rule and that I definitely am unworthy of their blessing. [the_tenno.GetSheHeCap] further tells me that I will need to work quite hard if I am to ever prove myself worthy of such an honor.;;;;;;;;;;;;;x
EVTOPTA_SOH_3710;How rude!;;;;;;;;;;;;;x
EVTDESC_SOH_3711;I tell [the_tenno.GetBestName] that I wished to converse with [the_tenno.GetHerHim] on anything that [the_tenno.GetSheHe] might want to talk about as I feel that the two of us might get along. [the_tenno.GetSheHeCap] is a bit surprised, but by the time I depart it is clear that both of us have enjoyed spending time together.;;;;;;;;;;;;;x
EVTOPTA_SOH_3711;We both had a good time!;;;;;;;;;;;;;x
EVTDESC_SOH_3712;[From.GetBestName] appears before me and falls to [From.GetHerHis] knees, as would be expected, and I bid [From.GetHerHim] to rise and inquire as to why [From.GetSheHe] asked for an audience. [From.GetSheHeCap] tells me that [From.GetSheHe] wished to talk to me for a bit to see if we might get along, and it turns out that we do.;;;;;;;;;;;;;x
EVTOPTA_SOH_3712;We both had a good time!;;;;;;;;;;;;;x
EVTDESC_SOH_3713;I tell [the_tenno.GetBestName] that I wished to converse with [the_tenno.GetHerHim] on anything that [the_tenno.GetSheHe] might want to talk about as I feel that the two of us might get along. [the_tenno.GetSheHeCap] is a bit surprised, but agrees to speak to me for a while. Sadly, we do not get along at all.;;;;;;;;;;;;;x
EVTOPTA_SOH_3713;That went poorly...;;;;;;;;;;;;;x
EVTDESC_SOH_3714;[From.GetBestName] appears before me and falls to [From.GetHerHis] knees, as would be expected, and I bid [From.GetHerHim] to rise and inquire as to why [From.GetSheHe] asked for an audience. [From.GetSheHeCap] tells me that [From.GetSheHe] wished to talk to me for a bit to see if we might get along. It turns out that we do not.;;;;;;;;;;;;;x
EVTOPTA_SOH_3714;Leave my presence at once!;;;;;;;;;;;;;x
EVTDESC_SOH_3716;I have been spending some time walking around and talking to both other pilgrims and various officials at the court of the [the_tenno.GetBestName], and I feel certain that as long as we keep our faith in the kami and work together we will be able to achieve anything, and any doubts that I once might have felt have been dispersed.;;;;;;;;;;;;;x
EVTOPTA_SOH_3716;My faith has never been stronger!;;;;;;;;;;;;;x
EVTDESC_SOH_3717;I have been spending some time walking around and talking to both other pilgrims and various officials at the court of the [the_tenno.GetBestName], and though I expected everyone here to be devout it has become clear that that is not the case. If those near the Chrysanthemum Throne itself see no reason to honor the kami it does not speak highly of the kami.;;;;;;;;;;;;;x
EVTOPTA_SOH_3717;It is all meaningless...;;;;;;;;;;;;;x
EVTDESC_SOH_3718;As I are walking around the palace of [the_tenno.GetBestName] I suddenly get a flash of inspiration and know that I have a message I must share with those around me. It might not be something that the people there will like to hear, but the words in my mind cannot be stopped, and they must be shared with those that do not yet know of them.;;;;;;;;;;;;;x
EVTOPTA_SOH_3718;THE KAMI SPEAK TO ME!;;;;;;;;;;;;;x
EVTDESC_SOH_3719;A servant comes hurrying into my presence, ignoring proper protocol as she immediately begins talking to me. It becomes clear that this is justifiable as she brings word that [From.GetBestName] apparently is screaming a message that supposedly comes directly from the kami at the top of [From.GetHerHis] voice, even though the message is most questionable.;;;;;;;;;;;;;x
EVTOPTA_SOH_3719;We must imprison this mad[From.GetManWoman]!;;;;;;;;;;;;;x
EVTOPTB_SOH_3719;We must make [From.GetHerHim] go away!;;;;;;;;;;;;;x
EVTOPTC_SOH_3719;Let's just ignore it...;;;;;;;;;;;;;x
EVTOPTD_SOH_3719;THE KAMI SPEAK TO [From.GetHerHimFullCaps]!;;;;;;;;;;;;;x
EVTDESC_SOH_3720;I am not really paying attention to my surroundings as I share the glorious truths that the kami have revealed to me, and thus I fail to notice the arrival of a group of guards before they are upon me. They quickly grab me and drag me away, and it is not long before I am tossed into an empty cell somewhere beneath the palace.;;;;;;;;;;;;;x
EVTOPTA_SOH_3720;The kami never mentioned this...;;;;;;;;;;;;;x
EVTDESC_SOH_3721;I am not really paying attention to my surroundings as I share the glorious truths that the kami have revealed to me, and thus I fail to notice the arrival of a group of guards before they are upon me. They quickly grab me and drag me to the outskirts of the palace, upon which they give me a shove to send me on my way.;;;;;;;;;;;;;x
EVTOPTA_SOH_3721;But I spoke the truth!;;;;;;;;;;;;;x
EVTDESC_SOH_3722;I speak at length, sharing the glorious truths that the kami have revealed to me with all nearby. Nobody really seems to be paying attention to me, however, and eventually I am forced to conclude that ,y words have fallen on deaf ears and that I probably would be better off sharing the truth elsewhere.;;;;;;;;;;;;;x
EVTOPTA_SOH_3722;YOU CAN'T IGNORE ME FOREVER!;;;;;;;;;;;;;x
EVTDESC_SOH_3723;I speak at length, sharing the glorious truths that the kami have revealed to me with all nearby. At first, people are skeptical, but then a messenger appears to inform those present that [the_tenno.GetBestName] [the_tenno.GetHerselfHimself] bids everyone to listen to me and my glorious truths. After that, the crowd pays attention to everything I tell them.;;;;;;;;;;;;;x
EVTOPTA_SOH_3723;I SPEAK THE TRUTH!;;;;;;;;;;;;;x
EVTDESC_SOH_3724;I have spent some time at the court of [the_tenno.GetBestName] and have met many people, among them [pilgrims_friend.GetBestName], a most interesting [pilgrims_friend.GetManWoman]. The two of us have a lot in common, and I feel confident that we will find reason to meet in the future as we both have been enjoying each other's company.;;;;;;;;;;;;;x
EVTOPTA_SOH_3724;I have a new friend!;;;;;;;;;;;;;x
EVTDESC_SOH_3725;I have spent some time at the court of [the_tenno.GetBestName] and have met many people, among them [pilgrims_rival.GetBestName], a most irksome [pilgrims_rival.GetManWoman]. [pilgrims_rival.GetSheHeCap] has made it clear that my presence is unwelcome this close to the Chrysanthemum Throne, and that [pilgrims_rival.GetSheHe] also finds me generally disagreeable.;;;;;;;;;;;;;x
EVTOPTA_SOH_3725;I must be on my guard against [pilgrims_rival.GetHerHim]...;;;;;;;;;;;;;x
EVTDESC_SOH_3726;Though I doubtlessly could spend more time at the court of the [the_tenno.GetBestName] I have been away from home for quite a while, and it would not be prudent to delay my return any longer. It is time to begin the journey back to [Root.Capital.GetName].;;;;;;;;;;;;;x
EVTOPTA_SOH_3726;I must head home!;;;;;;;;;;;;;x
EVTTITLE_SOH_3727;The Kumano Route;;;;;;;;;;;;;x
EVTDESC_SOH_3727;I have arrived at the start of the Kumano pilgrim route, along which a number of important shrines can be found, and though I have decided not to visit the grand shrine at Ise this time I will definitely visit quite a few shrines.\nI have noticed that there are plenty of other pilgrims around, so I will likely have some company on the road from time to time, and perhaps I might come across some noteworthy people.\nRegardless of who or what I might find along the pilgrim route, I must be prepared to keep on walking.;;;;;;;;;;;;;x
EVTOPTA_SOH_3727;I still have far to walk...;;;;;;;;;;;;;x
