#CODE;ENGLISH;FRENCH;GERMAN;;SPANISH;;;;;;;;;x
EVTOPTA_TIANXIA_241;Well, that was unhelpful...;;;;;;;;;;;;;x
EVTDESC_TIANXIA_242;The story told by the old man is very long, and quite questionable, but I keep listening in the hopes that the part where the dragonslayers actually face off against the dragon will contain something helpful. Unfortunately, that is not the case, as the dragonslayers prevail despite making several highly questionable decisions.;;;;;;;;;;;;;x
EVTOPTA_TIANXIA_242;Why would you stand in the fire?;;;;;;;;;;;;;x
EVTDESC_TIANXIA_243;The story told by the old man is quite engaging, and it contains a surprising amount of wisdom. Though some of the villagers give up partway through, I am enthralled. By the time that the man is finished I have started to formulate what I am convinced will be a very effective strategy against Fredak, the Emperor of Embers.;;;;;;;;;;;;;x
EVTOPTA_TIANXIA_243;I should stand in the fire!;;;;;;;;;;;;;x
EVTDESC_TIANXIA_244;For one reason or another [disagreement_target.GetBestName] seems to have become less happy with me during the course of our journey to the dragon's lair. One day, a truly innocent comment I make set [disagreement_target.GetHerHim] off, and [disagreement_target.GetSheHe] angrily proclaims that I am only on this quest due to my supposed vanity.;;;;;;;;;;;;;x
EVTOPTA_TIANXIA_244;Luckily I knew just what to day!;;;;;;;;;;;;;x
EVTOPTB_TIANXIA_244;I think I can fix this!;;;;;;;;;;;;;x
EVTOPTC_TIANXIA_244;[disagreement_target.GetSheHeCap] has crossed the line this time!;;;;;;;;;;;;;x
EVTDESC_TIANXIA_245;Despite [disagreement_target.GetBestName] being quite unhappy I manage to turn the situation around in short order. While we might perhaps not be quite as happy with one another's company as we were before, I am confident that the two of us will still be able to fight side by side with the knowledge that we can rely upon one another.;;;;;;;;;;;;;x
EVTOPTA_TIANXIA_245;It was just a minor disagreement;;;;;;;;;;;;;x
EVTDESC_TIANXIA_246;My words do not seem to calm [disagreement_target.GetBestName] down completely, but though I feel that our relationship will be a bit strained in the days to come the argument is at least over for the moment. Hopefully, this will not cause any further problems, as we certainly could do without them.;;;;;;;;;;;;;x
EVTOPTA_TIANXIA_246;Could have been worse...;;;;;;;;;;;;;x
EVTDESC_TIANXIA_247;My attempt to make things better has the opposite effect of what I intended, and soon I and [disagreement_target.GetBestName] are shouting at one another. Though we eventually lower our voices and continue on our way, I do not feel that I can put the argument behind me. With friends like these, who needs enemies?;;;;;;;;;;;;;x
EVTOPTA_TIANXIA_247;I almost wish [From.GetSheHe] had left!;;;;;;;;;;;;;x
EVTDESC_TIANXIA_248;U have been travelling with [friendship_target.GetBestName] for a while now, and we have both come to enjoy each other's company. Of all the people I could have at my side when I face Fredak, the Emperor of Embers, I can hardly think of anyone better, or at least not anyone I could rely upon to the same extent.;;;;;;;;;;;;;x
EVTOPTA_TIANXIA_248;Best friends forever!;;;;;;;;;;;;;x
EVTDESC_TIANXIA_249;Over the course of my journey with [lover_target.GetBestName] we have become much closer, and I cannot deny that [lover_target.GetSheHe] certainly is a good-looking [lover_target.GetManWoman]. Perhaps the attraction is mutual, and in that case the two of us certainly would be able to spend quite a few nights together while we are on the road.;;;;;;;;;;;;;x
EVTOPTA_TIANXIA_249;It wouldn't hurt to ask...;;;;;;;;;;;;;x
EVTOPTB_TIANXIA_249;I don't think so...;;;;;;;;;;;;;x
EVTDESC_TIANXIA_250;I and [From.GetBestName] have grown rather close during our journey together, and I have to admit that [From.GetSheHe] is rather fetching. It does not really surprise me when [From.GetSheHe] suggests that the two of us should spend the night together.;;;;;;;;;;;;;x
EVTOPTA_TIANXIA_250;Your tent, or mine?;;;;;;;;;;;;;x
EVTOPTB_TIANXIA_250;I don't think so!;;;;;;;;;;;;;x
EVTDESC_TIANXIA_251;To my delight [From.GetBestName] is receptive to my advances and we spend a very enjoyable night together. When morning comes and the two of us wake up I know that I have to make a decision as to whether we should go back to the way things were before or if we should continue spending the night together in the future.;;;;;;;;;;;;;x
EVTOPTA_TIANXIA_251;We should do this again!;;;;;;;;;;;;;x
EVTOPTB_TIANXIA_251;This won't continue...;;;;;;;;;;;;;x
EVTDESC_TIANXIA_252;I and [From.GetBestName] spend the night together, and it is certainly an enjoyable time. When morning comes it is clear that both of us wish for this to continue, at least for the foreseeable future. It will perhaps not give us any real advantage once we face Fredak, the Emperor of Embers, but the journey should certainly be more enjoyable.;;;;;;;;;;;;;x
EVTOPTA_TIANXIA_252;This must be love!;;;;;;;;;;;;;x
EVTDESC_TIANXIA_253;While I and [From.GetBestName] spend what I would consider a very enjoyable night together it does not seem that [From.GetSheHe] is interested in making a habit out of it. I am certainly not told this in a cruel way, but it is still presented in a manner that makes it abundantly clear that [From.GetBestName] has made up [From.GetHerHis] mind.;;;;;;;;;;;;;x
EVTOPTA_TIANXIA_253;Perhaps it is for the best...;;;;;;;;;;;;;x
EVTDESC_TIANXIA_254;It appears that the attraction I feel towards [From.GetBestName] is not mutual. At the very least, [From.GetSheHe] rather firmly tells me that [From.GetSheHe] has no interest in spending the night with me, and suggests that I drop the matter and that the two of us continue as if I never had seen fit to ask.;;;;;;;;;;;;;x
EVTOPTA_TIANXIA_254;Fine! Be that way!;;;;;;;;;;;;;x

EVTTITLE_TIANXIA_255;Power at a Price;;;;;;;;;;;;;x
EVTDESC_TIANXIA_255_A;I wake up in the middle of the night, noticing a chill in the air. A beautiful, if somewhat strange, woman with a severe expression on her face is standing over me.\n\n"You are a brave [Root.GetManWoman]," she says. "Few would dare seek the lair of a being as powerful as Fredak, the Emperor of Embers. As things currently stand, you might not prevail, but that can change." She gives me a thin smile.\n\n"I can give you the power to defeat your foe. All I want in return is a year of your memories. You will hardly notice that they are gone. What say you?";;;;;;;;;;;;;x
EVTDESC_TIANXIA_255_B;I wake up in the middle of the night, noticing a chill in the air. A beautiful, if somewhat strange, woman with a severe expression on her face is standing over me.\n\n"You are a brave [Root.GetManWoman]," she says. "Few would dare seek the lair of a being as powerful as Fredak, the Emperor of Embers. As things currently stand, you might not prevail, but that can change." She gives me a thin smile.\n\n"I can give you the power to defeat your foe. All I want in return is a possession of yours, specifically your [mabs_price_artifact.GetName]. What say you?";;;;;;;;;;;;;x
EVTDESC_TIANXIA_255_C;I wake up in the middle of the night, noticing a chill in the air. A beautiful, if somewhat strange, woman with a severe expression on her face is standing over me.\n\n"You are a brave [Root.GetManWoman]," she says. "Few would dare seek the lair of a being as powerful as Fredak, the Emperor of Embers. As things currently stand, you might not prevail, but that can change." She gives me a thin smile.\n\n"I can give you the power to defeat your foe. All I want in return is a little thing, specifically your firstborn, [mabs_price_firstborn.GetBestName]. What say you?";;;;;;;;;;;;;x
EVTDESC_TIANXIA_255_D;I wake up in the middle of the night, noticing a chill in the air. A beautiful, if somewhat strange, woman with a severe expression on her face is standing over me.\n\n"You are a brave [Root.GetManWoman]," she says. "Few would dare seek the lair of a being as powerful as Fredak, the Emperor of Embers. As things currently stand, you might not prevail, but that can change." She gives me a thin smile.\n\n"I can give you the power to defeat your foe. All I want in return is a year of your life. You will hardly notice that you have lost it. What say you?";;;;;;;;;;;;;x
EVTDESC_TIANXIA_255_E;I wake up in the middle of the night, noticing a chill in the air. A beautiful, if somewhat strange, woman with a severe expression on her face is standing over me.\n\n"You are a brave [Root.GetManWoman]," she says. "Few would dare seek the lair of a being as powerful as Fredak, the Emperor of Embers. As things currently stand, you might not prevail, but that can change." She gives me a thin smile.\n\n"I can give you the power to defeat your foe. All I want in return is your love for [mabs_price_lover.GetBestName]. What say you?";;;;;;;;;;;;;x
EVTOPTA_TIANXIA_255;I think not!;;;;;;;;;;;;;x
EVTOPTB_TIANXIA_255;I will pay your price!;;;;;;;;;;;;;x
EVTOPTC_TIANXIA_255;Taste my steel!;;;;;;;;;;;;;x
DRAW_STEEL;I will draw my sword to attack the strange woman;;;;;;;;;;;;;x
EVTDESC_TIANXIA_256_A;A few nights later I wake up to find the same woman standing above me again, seemingly unconcerned about the chill in the air.\n\n"Again I will offer," she says, her expression unreadable. "Power for you to use to defeat Fredak, the Emperor of Embers, at the end of your quest, in exchange for a year of your memories. What say you?";;;;;;;;;;;;;x
EVTDESC_TIANXIA_256_B;A few nights later I wake up to find the same woman standing above me again, seemingly unconcerned about the chill in the air.\n\n"Again I will offer," she says, her expression unreadable. "Power for you to use to defeat Fredak, the Emperor of Embers, at the end of your quest, in exchange for your [mabs_price_artifact.GetName]. What say you?";;;;;;;;;;;;;x
EVTDESC_TIANXIA_256_C;A few nights later I wake up to find the same woman standing above me again, seemingly unconcerned about the chill in the air.\n\n"Again I will offer," she says, her expression unreadable. "Power for you to use to defeat Fredak, the Emperor of Embers, at the end of your quest, in exchange for your firstborn, [mabs_price_firstborn.GetBestName]. What say you?";;;;;;;;;;;;;x
EVTDESC_TIANXIA_256_D;A few nights later I wake up to find the same woman standing above me again, seemingly unconcerned about the chill in the air.\n\n"Again I will offer," she says, her expression unreadable. "Power for you to use to defeat Fredak, the Emperor of Embers, at the end of your quest, in exchange for a year of your life. What say you?";;;;;;;;;;;;;x
EVTDESC_TIANXIA_256_E;A few nights later I wake up to find the same woman standing above me again, seemingly unconcerned about the chill in the air.\n\n"Again I will offer," she says, her expression unreadable. "Power for you to use to defeat Fredak, the Emperor of Embers, at the end of your quest, in exchange for a your love for [mabs_price_lover.GetBestName]. What say you?";;;;;;;;;;;;;x
EVTOPTA_TIANXIA_256;Still not interested!;;;;;;;;;;;;;x
EVTOPTB_TIANXIA_256;On second thought, I accept!;;;;;;;;;;;;;x
EVTOPTC_TIANXIA_256;Get out! Get out!;;;;;;;;;;;;;x
EVTDESC_TIANXIA_257_A;I am not particularly surprised when I open my eyes and see the same strangely beautiful woman standing above me once again a few nights later, still not showing any discomfort in the cold.\n\n"Thrice I offer and done," she tells me. "A gift of some of my power, so that you may defeat Fredak, the Emperor of Embers, for a year of your memories. What say you?;;;;;;;;;;;;;x
EVTDESC_TIANXIA_257_B;I am not particularly surprised when I open my eyes and see the same strangely beautiful woman standing above me once again a few nights later, still not showing any discomfort in the cold.\n\n"Thrice I offer and done," she tells me. "A gift of some of my power, so that you may defeat Fredak, the Emperor of Embers, for your [mabs_price_artifact.GetName]. What say you?;;;;;;;;;;;;;x
EVTDESC_TIANXIA_257_C;I am not particularly surprised when I open my eyes and see the same strangely beautiful woman standing above me once again a few nights later, still not showing any discomfort in the cold.\n\n"Thrice I offer and done," she tells me. "A gift of some of my power, so that you may defeat Fredak, the Emperor of Embers, for your firstborn, [mabs_price_firstborn.GetBestName]. What say you?;;;;;;;;;;;;;x
EVTDESC_TIANXIA_257_D;I am not particularly surprised when I open my eyes and see the same strangely beautiful woman standing above me once again a few nights later, still not showing any discomfort in the cold.\n\n"Thrice I offer and done," she tells me. "A gift of some of my power, so that you may defeat Fredak, the Emperor of Embers, for a year of your life. What say you?;;;;;;;;;;;;;x
EVTDESC_TIANXIA_257_E;I am not particularly surprised when I open my eyes and see the same strangely beautiful woman standing above me once again a few nights later, still not showing any discomfort in the cold.\n\n"Thrice I offer and done," she tells me. "A gift of some of my power, so that you may defeat Fredak, the Emperor of Embers, for a your love for [mabs_price_lover.GetBestName]. What say you?;;;;;;;;;;;;;x
EVTOPTA_TIANXIA_257;And thrice I refuse!;;;;;;;;;;;;;x
EVTOPTB_TIANXIA_257;I accept your bargain!;;;;;;;;;;;;;x
EVTOPTC_TIANXIA_257;I have had enough of you!;;;;;;;;;;;;;x
EVTDESC_TIANXIA_258;"Your bravery is admirable, [Root.GetBestName], and you have treated fairly," the woman says, giving me a small nod. "I shall take my leave, and not return. It is unfortunate that we could not make a bargain, but I wish you luck in your endeavour. Fare thee well."\n\nWith that, she vanishes without a trace.;;;;;;;;;;;;;x
EVTOPTA_TIANXIA_258;What a strange woman...;;;;;;;;;;;;;x
EVTDESC_TIANXIA_259;"Done," the woman says. "Done. And done."\n\nI feel some of the cold around me shift and move into my body, and I know without a doubt that I have received the power I bargained for. Moreover, I know that the price has been paid.\n\n"Fare thee well, [Root.GetBestName]," the woman says, vanishing without a trace.;;;;;;;;;;;;;x
EVTOPTA_TIANXIA_259;I hope it was worth it...;;;;;;;;;;;;;x
EVTDESC_TIANXIA_260;The already cold air becomes truly freezing as the first inch of my blade clears the scabbard, and I find myself unable to move.\n\n"You seek to draw steel against me?" the woman asks furiously. "A curse upon you and your quest, for all eternity!" With that, she vanishes as if she had never been there, though the chill lingers.;;;;;;;;;;;;;x
EVTOPTA_TIANXIA_260;I feel... strange...;;;;;;;;;;;;;x
EVTDESC_TIANXIA_261;One day on the road I and my companions come across the ruins of a village. We search for survivours and find a few badly burned individuals on the cusp of death. Before they die they tell us that Fredak, the Emperor of Embers, attacked them and that nothing they did seemed to as much as slightly inconvenience the gargantuan red dragon.;;;;;;;;;;;;;x
EVTOPTA_TIANXIA_261;Proof I must continue!;;;;;;;;;;;;;x
EVTOPTB_TIANXIA_261;Proof this is a fool's errand...;;;;;;;;;;;;;x
RETURN_HOME;I decide to abandon my quest, at least for now.;;;;;;;;;;;;;x
EVTDESC_TIANXIA_262;One day when I am scouting ahead of my party I come across a small stone tower next to the road just as I am about to return from what turned out to be a detour. It appears to be in rather good condition, which is rather strange this far away from any settlements. Perhaps it is something to investigate before returning to the party?;;;;;;;;;;;;;x
EVTOPTA_TIANXIA_262;I will enter the tower!;;;;;;;;;;;;;x
EVTOPTB_TIANXIA_262;I should leave...;;;;;;;;;;;;;x
EVTDESC_TIANXIA_263;I make my way inside the stone tower and take a look around. There are several rooms inside the tower, but all of them are completely empty, and I cannot determine the reason why it was constructed. As I finish my investigation and turn to leave the tower I accidentally step on a small, triangular object that has been left unattended on the floor.;;;;;;;;;;;;;x
EVTOPTA_TIANXIA_263;Ow!;;;;;;;;;;;;;x
EVTDESC_TIANXIA_264;I enter the tower and climb the staircase I find just inside, entering a large room on the next floor. A stone pedestal is located at the centre of the room, upon which a large dodecahedron rests, emitting a dull grey glow. I also notice a hooded figure standing near the pedestal.\n\n"Leave this place!" the figure tells me.;;;;;;;;;;;;;x
EVTOPTA_TIANXIA_264;I mean no harm!;;;;;;;;;;;;;x
EVTOPTB_TIANXIA_264;Step aside or die!;;;;;;;;;;;;;x
EVTOPTC_TIANXIA_264;I'll just leave...;;;;;;;;;;;;;x
EVTDESC_TIANXIA_265;The figure seems to consider my words for a moment before shrugging.\n\n"Very well," it says. "You may approach the Beacon. It will not harm you, and neither will I."\n\nStepping up to the pedestal, I carefully reach out to touch the dodecahedron. As I do so, I feel some kind of energy flow into me.;;;;;;;;;;;;;x
EVTOPTA_TIANXIA_265;I feel empowered!;;;;;;;;;;;;;x
EVTDESC_TIANXIA_266;The figure seems to consider my words for a moment before pulling out a sword from somewhere inside its robe.\n\n"You are unworthy of the Beacon's power," it says. "Leave this place now, or I shall compel you by force of arms." Judging by their stance, they know how to use their weapon quite well.;;;;;;;;;;;;;x
EVTOPTA_TIANXIA_266;You shall not stop me!;;;;;;;;;;;;;x
EVTOPTB_TIANXIA_266;I'll be on my way!;;;;;;;;;;;;;x
EVTDESC_TIANXIA_267;Though it is a difficult fight, I eventually get the upper hand against the hooded figure, and my opponent's sword goes flying from their hand.\n\n"I cannot stop you from claiming the Beacon's power, it seems," the figure says, snapping its fingers and vanishing without a trace.;;;;;;;;;;;;;x
EVTOPTA_TIANXIA_267;Victory is mine!;;;;;;;;;;;;;x
EVTDESC_TIANXIA_268;I and the figure exchange blows, and eventually I gain the upper hand, driving them back before you.\n\n"It seems I cannot defeat you," the figure notes. "Luckily, I can still prevent you from claiming the Beacon."\n\nIt snaps its fingers, and both it and the dodecahedron vanish without a trace.;;;;;;;;;;;;;x
EVTOPTA_TIANXIA_268;Well, that was odd...;;;;;;;;;;;;;x
EVTDESC_TIANXIA_269;Though the fight appears to be even to begin with, my opponent soon gain the upper hand, and I take several wounds.\n\n"Be thankful I do not seek to harm you any further," the figure says, snapping its fingers and vanishing without a trace, along with the dodecahedron.;;;;;;;;;;;;;x
EVTOPTA_TIANXIA_269;Curses!;;;;;;;;;;;;;x
EVTDESC_TIANXIA_270;The fight quickly turns against me, and though I manage to avoid taking any fatal injuries I am still grievously wounded.\n\n"Let this be a lesson to you," your opponent says, snapping their fingers and vanishing without a trace, along with the dodecahedron.;;;;;;;;;;;;;x
EVTOPTA_TIANXIA_270;This did not go as planned...;;;;;;;;;;;;;x
EVTDESC_TIANXIA_271;To call the battle uneven would be a kindness, and before long I find myself bleeding out on the ground.\n\n"You were unworthy, and you have paid the price," the figure tells me. It snaps its fingers and vanishes, along with the dodecahedron.;;;;;;;;;;;;;x
EVTOPTA_TIANXIA_271;No! No! No!;;;;;;;;;;;;;x
EVTDESC_TIANXIA_272;I enter the tower and make my way to the second level, finding myself in a room containing a stone pedestal upon which a dodecahedron emitting a faint grey glow sits. Filled with curiosity, I move up to it and reach out to grasp it. As I do so, I feel a strange power flowing into me.;;;;;;;;;;;;;x
EVTOPTA_TIANXIA_272;Such possibilities!;;;;;;;;;;;;;x
EVTDESC_TIANXIA_273;[From.GetBestName] is currently on a journey to the lair of Fredak, the Emperor of Embers, and is thus relatively unprotected due to only having a small party of travelling companions with [From.GetHerHim]. Perhaps sending an assassin after [From.GetHerHim] at this time would be a wise course of action, as that would rid me of a most troublesome rival...;;;;;;;;;;;;;x
EVTOPTA_TIANXIA_273;I know just the woman!;;;;;;;;;;;;;x
EVTOPTB_TIANXIA_273;That would be a waste of money...;;;;;;;;;;;;;x
EVTDESC_TIANXIA_274;I awake in the middle of the night feeling a knife being slashed across across my throat. Blood starts pouring out even before my attacker has vanished into the night. Though I do your best to stop the bleeding, it is ultimately futile, and I can feel my life slipping away, mu quest unfulfilled.;;;;;;;;;;;;;x
EVTOPTA_TIANXIA_274;Who killed me?;;;;;;;;;;;;;x
EVTDESC_TIANXIA_275;I awake in the middle of the night hearing the sound of movement nearby. Looking up, I can see a shrouded woman standing above me, with a knife at the ready.\n\n"[From.GetBestName] sends [From.GetHerHis] regards," she tells me, leaning in and cutting my throat before vanishing into the night.;;;;;;;;;;;;;x
EVTOPTA_TIANXIA_275;Avenge me!;;;;;;;;;;;;;x
EVTDESC_TIANXIA_276;The assassin I sent after [From.GetBestName] has reported back to me, her mission successfully completed. As I wanted to prevent her from taking my money and running away without carrying out her job, I had promised her an equal amount once her mission was over, but now I find myself wondering if I need her or her services any longer...;;;;;;;;;;;;;x
EVTOPTA_TIANXIA_276;Guards! Rid me of this loose end!;;;;;;;;;;;;;x
EVTOPTB_TIANXIA_276;Here's your money, as promised!;;;;;;;;;;;;;x
EVTDESC_TIANXIA_277;One night I wake up and find a knife-wielding woman inside my tent. She notices that yI am awake and immediately attacks me, inflicting a fairly minor wound, and then exits the tent in a hurry. My companions fail to catch her as she makes her way into the night. I half expect her to return to try to kill me again, but she does not.;;;;;;;;;;;;;x
EVTOPTA_TIANXIA_277;Who sent her?;;;;;;;;;;;;;x
EVTDESC_TIANXIA_278;The woman I sent to kill [From.GetBestName] has returned, her mission unfinished. She tries to plead her case, noting that she wounded her target and that she had the courtesy to return to me to inform me of what happened instead of leaving me in the dark, but the fact that she failed remains.;;;;;;;;;;;;;x
EVTOPTA_TIANXIA_278;You have failed me for the last time!;;;;;;;;;;;;;x
EVTOPTB_TIANXIA_278;Get out!;;;;;;;;;;;;;x
EVTDESC_TIANXIA_279;One night as I am about to fall asleep an armed woman I have never seen before enters my tent, immediately moving to attack me. I manage to avoid the worst of the attack and grab my weapon to fight back, successfully inflicting a fatal wound on my attacker, who dies before she can reveal who sent her.;;;;;;;;;;;;;x
EVTOPTA_TIANXIA_279;Who could be behind this?;;;;;;;;;;;;;x
EVTDESC_TIANXIA_280;My spies inform me that the woman I sent to kill [From.GetBestName] was killed in the attempt, but that her target was seen clearly wounded the day after the attack. Given that [From.GetBestName] doubtlessly will be on [From.GetHerHis] guard against further attempts, it would be foolish to send another assassin at this point.;;;;;;;;;;;;;x
EVTOPTA_TIANXIA_280;At least she hurt [From.GetHerHim]...;;;;;;;;;;;;;x
EVTDESC_TIANXIA_281;One evening when I am making camp an armed woman suddenly appears out of the night, attacking me almost before I can notice her. I take a wound from the first strike, but successfully prevent her from harming me any further, and she is soon bleeding out on the ground.\n\n"[From.GetBestName] said you were good," are her final words.;;;;;;;;;;;;;x
EVTOPTA_TIANXIA_281;This will not be forgotten!;;;;;;;;;;;;;x
EVTDESC_TIANXIA_282;My spies inform you that the assassin I hired to kill [From.GetBestName] failed to complete her job. She apparently managed to inflict a wound, but any good that caused is insignificant next to the news that she apparently divulged my name before she died, seeing as [From.GetBestName] was heard denouncing me in a nearby village the next day.;;;;;;;;;;;;;x
EVTOPTA_TIANXIA_282;This was not what I had in mind...;;;;;;;;;;;;;x
EVTDESC_TIANXIA_283;I awake in the middle of night hearing the sound of fighting outside my tent. Drawing my weapon, I emerge and find my party standing over the body of an unfamiliar armed woman. My companions explain that she was caught sneaking into our encampment, doubtlessly planning to assassinate me, and I see no reason not to believe them.;;;;;;;;;;;;;x
EVTOPTA_TIANXIA_283;I wonder who sent her...;;;;;;;;;;;;;x
EVTDESC_TIANXIA_284;The spies I had placed in a village near where [From.GetBestName] was travelling have reported back, informing me that my rival's companions were overheard talking about a failed assassination attempt. Based on the description of the attacker, it would seem that the woman I hired has failed to carry out her job.;;;;;;;;;;;;;x
EVTOPTA_TIANXIA_284;Disappointing!;;;;;;;;;;;;;x
EVTDESC_TIANXIA_285;The sound of fighting wakes me from my slumber, and I quickly arm myself and leave my tent. I find my companions standing around a fatally injured woman I have never seen before.\n\n"[From.GetBestName] sent me," the woman says. "I see no reason to keep that secret, now.".;;;;;;;;;;;;;x
EVTOPTA_TIANXIA_285;I will remember this!;;;;;;;;;;;;;x
EVTDESC_TIANXIA_286;The spies I had following [From.GetBestName]'s party have sent a most troubling report. Not only did the assassin I hired die attempting to carry out her task, she apparently saw fit not to take the secret of my involvement to her grave, as my spies have heard [From.GetBestName]'s guards say as much in their presence.;;;;;;;;;;;;;x
EVTOPTA_TIANXIA_286;I expected better of her!;;;;;;;;;;;;;x
EVTDESC_TIANXIA_287;One day when travelling through the wilderness on your my to the lair of Fredak, the Emperor of Embers I stumble across some strange ruins on a hillside. The ruins appear to be quite extensive, and could contain all manner of things. My party is waiting for me further down the road, but they probably would not mind me being late.;;;;;;;;;;;;;x
EVTOPTA_TIANXIA_287;I'll investigate the ruins!;;;;;;;;;;;;;x
