#CODE;ENGLISH;FRENCH;GERMAN;;SPANISH;;;;;;;;;x
EVTOPTB_TIANXIA_287;I'll continue on my journey...;;;;;;;;;;;;;x
EVTDESC_TIANXIA_289;As I move deeper into the ruins I come across a stone door with a large number of keyholes. Judging by the fact that there is an arrow-studded corpse on the ground in front of the door that is clutching an ornate key, someone attempted to unlock the door but choose the keyhole... poorly...;;;;;;;;;;;;;x
EVTOPTA_TIANXIA_289;I will try a random keyhole;;;;;;;;;;;;;x
EVTOPTB_TIANXIA_289;I will inspect the key;;;;;;;;;;;;;x
EVTOPTC_TIANXIA_289;I can go no further...;;;;;;;;;;;;;x
EVTDESC_TIANXIA_290;I pick up the key and move over to the door, trying to determine if there is anything noteworthy about any of the keyholes, but that does not seem to be the case. Taking a deep breath and preparing myself for the worst, I pick a keyhole at random. To my great delight, the door is easily unlocked and no arrows come flying in my direction.;;;;;;;;;;;;;x
EVTOPTA_TIANXIA_290;Luck is with me, it seems...;;;;;;;;;;;;;x
EVTDESC_TIANXIA_291;I pick up the key and inspect it. It is quite big, rather ornate, and made from some unknown metal. As best I can tell, it is quite ancient. Turning the key over in my hand, I notice some symbols decorating the other side of it, which seem to depict the door and one keyhole in particular. I try this keyhole and successfully unlock the door.;;;;;;;;;;;;;x
EVTOPTA_TIANXIA_291;That was straightforward...;;;;;;;;;;;;;x
EVTDESC_TIANXIA_292;I pick up the key and move over to the door, trying to determine if there is anything noteworthy about any of the keyholes, but that does not seem to be the case. Taking a deep breath and preparing myself for the worst, I pick a keyhole at random. Arrows immediately come flying at me, and though I avoid most of them I dare not try again.;;;;;;;;;;;;;x
EVTOPTA_TIANXIA_292;Time to leave, it seems...;;;;;;;;;;;;;x
EVTDESC_TIANXIA_293;As I am moving deeper into the ruins I notice that the room ahead of me is illumiated by torchlight from the inside. Sneaking up to the doorway, I notice that a number of bandits are located inside the room, arguing with each other about something. They have not noticed me yet, but I will have to fight them if I want to continue.;;;;;;;;;;;;;x
EVTOPTA_TIANXIA_293;They will not stop me!;;;;;;;;;;;;;x
EVTOPTB_TIANXIA_293;I can go no further...;;;;;;;;;;;;;x
EVTDESC_TIANXIA_294;I ready my weapon and enter the room, catching the bandits unaware. Two of them go down without even noticing that I am there, and two more barely have time to draw their weapons before they fall. The remaining two do their best to fight back, but though they last longer than the others they do not even manage to draw blood before they fall.;;;;;;;;;;;;;x
EVTOPTA_TIANXIA_294;Rabble is easily dispersed!;;;;;;;;;;;;;x
EVTDESC_TIANXIA_295;I ready my weapon and enter the room, catching the bandits mostly unaware. One of them sees me and gives out a cry before I cut him down, and I manage to strike down another before he can draw his sword. The rest manage to put up a fight, and I take a few wounds before I manage to kill them all. The way forward is open.;;;;;;;;;;;;;x
EVTOPTA_TIANXIA_295;They fought well!;;;;;;;;;;;;;x
EVTDESC_TIANXIA_296;I ready my weapon and enter the room. The bandits notice me before I manage to get close to any of them, and they draw their weapons and run at me. I take several wounds in quick succession, but remain standing. Though badly wounded by the end, I manage to defeat all of the bandits, but I am too badly injured to continue.;;;;;;;;;;;;;x
EVTOPTA_TIANXIA_296;I must leave...;;;;;;;;;;;;;x
EVTDESC_TIANXIA_297;I ready my weapon and enter the room, and the bandits are ready for my approach, drawing their weapons as soon as I enter. I put up a good fight, all things considered, but even though I manage to inflict several wounds on the bandits I take even more wounds in return. Before long, I fall to the ground, and I cannot get back up again.;;;;;;;;;;;;;x
EVTOPTA_TIANXIA_297;Nooooooo!;;;;;;;;;;;;;x
EVTDESC_TIANXIA_298;As I move deeper into the ruins something about the passageway I am moving through fills me with unease. I cannot quite say what it is that makes me feel that way, and perhaps it is nothing at all, but maybe it would be prudent to leave the ruins without delving any deeper, even though that would mean I would never find out what lies inside.;;;;;;;;;;;;;x
EVTOPTA_TIANXIA_298;I will delve deeper!;;;;;;;;;;;;;x
EVTOPTB_TIANXIA_298;I should leave...;;;;;;;;;;;;;x
EVTDESC_TIANXIA_299;I keep moving down the passageway, still feeling at unease. As I take another step the stone beneath my foot suddenly moves downwards ever so sligthly. Realizing what is going on, I quickly move backwards, managing to avoid a number of rocks that suddenly drop down from above where I would have been standing if I had continued forward...;;;;;;;;;;;;;x
EVTOPTA_TIANXIA_299;A clever trap, but not clever enough!;;;;;;;;;;;;;x
EVTDESC_TIANXIA_300;I keep moving down the passageway, still feeling at unease. As I take another step the stone beneath my foot suddenly moves downwards ever so sligthly. I take a moment too long to realize what is happening and fail to completely avoid the rocks that fall down from above, but as I avoided the worst of it I feel that I can continue.;;;;;;;;;;;;;x
EVTOPTA_TIANXIA_300;That wasn't so bad...;;;;;;;;;;;;;x
EVTDESC_TIANXIA_301;I keep moving down the passageway, still feeling at unease. As I take another step the stone beneath my foot suddenly moves downwards ever so sligthly. Before I realize what is happening, a number of rocks fall down on top of me, and though I manage to avoid death I am too injured to be able to continue deeper into the ruins.;;;;;;;;;;;;;x
EVTOPTA_TIANXIA_301;I need to leave now...;;;;;;;;;;;;;x
EVTDESC_TIANXIA_302;I keep moving down the passageway, still feeling at unease. Nothing seems to happen as I move forward, at least not until a number of large rocks fall from the ceiling, landing on top of me. I am grievously injured by the rocks and bleeding very badly, and when I attempt to move the rocks aside I realize that that is not going to be possible.;;;;;;;;;;;;;x
EVTOPTA_TIANXIA_302;Not like this!;;;;;;;;;;;;;x
EVTDESC_TIANXIA_304;I continue deeper into the ruins and eventually end up in a room with a closed stone door on the other side, next to which there is a chain with a handle. A short distance away from the door there are several columns decorated with symbols, which appear to be possible to rotate. No doubt there is a connection between the symbols and the door.;;;;;;;;;;;;;x
EVTOPTA_TIANXIA_304;I will try a random combination;;;;;;;;;;;;;x
EVTOPTB_TIANXIA_304;I will investigate the walls;;;;;;;;;;;;;x
EVTOPTC_TIANXIA_304;I should leave the ruins...;;;;;;;;;;;;;x
EVTDESC_TIANXIA_305;I rotate the pillars at random until I arrive at a combination I like and then move over to the door. Pulling on the handle affixed to the chain next to the door, I am pleasantly surprised when I hear the sound of some kind of locking mechanism inside the door comes unlocked. It is a trivial matter to open the doors and continue onwards.;;;;;;;;;;;;;x
EVTOPTA_TIANXIA_305;Luck is on my side, it seems...;;;;;;;;;;;;;x
EVTDESC_TIANXIA_306;I take a look at the walls of the room and notice that they are mostly bare of decorations. However, there is a trio of symbols high above the stone door, which I can also see on the rotating pillars. It is a simple matter to turn the pillars around until the symbols on them line up with those above the door, and the way forward is easily opened.;;;;;;;;;;;;;x
EVTOPTA_TIANXIA_306;How simple!;;;;;;;;;;;;;x
EVTDESC_TIANXIA_307;I rotate the pillars at random until I arrive at a combination I like and then move over to the door. When I pull on the handle affixed to the chain next to the door I hear something moving inside the wall, and unfortunately for me it is not a locking mechanism. Several arrows pierce my body, and it would be too risky to try again.;;;;;;;;;;;;;x
EVTOPTA_TIANXIA_307;I must withdraw...;;;;;;;;;;;;;x
EVTDESC_TIANXIA_308;As I move deeper into the ruins I find the way forward blocked by a number of swinging blades, kept in motion by some unknown mechanism. Studying their movement, I see that there are clear gaps, but whether I would be able to make use of them is hard to say. Doubtlessly, failure would be most unpleasant, possibly even deadly...;;;;;;;;;;;;;x
EVTOPTA_TIANXIA_308;I can get past this!;;;;;;;;;;;;;x
EVTOPTB_TIANXIA_308;This is far too dangerous...;;;;;;;;;;;;;x
EVTDESC_TIANXIA_309;I take some time to study the pattern and eventually decide that I have it memorized. Counting carefully, I move into the passage with the swinging blades, successfully avoiding them all and making my way to the other side. Once there, I find a lever that stops the blades from moving, making it a trivial matter to escape again.;;;;;;;;;;;;;x
EVTOPTA_TIANXIA_309;Simple enough...;;;;;;;;;;;;;x
EVTDESC_TIANXIA_310;I do my best to memorize the pattern of the swinging blades, and once I think I have it figured out I make my move. At first, everything goes well, but as I keep moving deeper into the room I make a mistake and take a grievous wound as a result. Though I manage to make my way back to the entrance it is clearly too risky to try again.;;;;;;;;;;;;;x
EVTOPTA_TIANXIA_310;I must withdraw...;;;;;;;;;;;;;x
EVTDESC_TIANXIA_311;Thinking I have figured out the pattern of the swinging blades, I run into the passageway, expecting to reach the other side without issue. Unfortunately for me, I did not have the pattern memorized correctly, and one of the blades inflicts a terrible wound on me, and as I decide I need to escape I take another, fatal wound.;;;;;;;;;;;;;x
EVTOPTA_TIANXIA_311;NO!;;;;;;;;;;;;;x
EVTDESC_TIANXIA_312;I move deeper into the ruins and eventually find myself in a very large chamber. Most of the floor inside it is covered by symbols, and it is clear to me that I am supposed to be stepping in the right places to avoid having something terrible happen to me. Whether I would be able to figure out where to step is hard to say.;;;;;;;;;;;;;x
EVTOPTA_TIANXIA_312;I think I see the path...;;;;;;;;;;;;;x
EVTOPTB_TIANXIA_312;I should leave...;;;;;;;;;;;;;x
EVTDESC_TIANXIA_313;Inspecting the symbols, I eventually realize that a number of them are identical and located rather close together. I tentatively step onto the closest one, and it does not give way under my feet even though a couple of others that are nearby drop into a pit beneath the floor. I continue forward with great care and eventually get across.;;;;;;;;;;;;;x
EVTOPTA_TIANXIA_313;It was quite simple!;;;;;;;;;;;;;x
EVTDESC_TIANXIA_314;I step out onto one of the symbols, and nothing happens. Confident that I know how to proceed, I take a second step, and that proves to be a mistake. The floor gives way under my foot, and though I attempt to move back to the safe floorstone I previously had stepped on I am unable to do so, and I fall into a deep pit.;;;;;;;;;;;;;x
EVTOPTA_TIANXIA_314;AAAARGH!;;;;;;;;;;;;;x
EVTDESC_TIANXIA_315;I have finally reached what appears to be the heart of the ruins, and I find myself in a chamber that is much larger than any of those I encountered previously. Most of the walls are rather plain, but the one on the opposite side from where I entered appears to be glowing very faintly, even though I cannot see how that could be.;;;;;;;;;;;;;x
EVTOPTA_TIANXIA_315;I should investigate the glowing wall!;;;;;;;;;;;;;x
EVTOPTB_TIANXIA_315;This is a trap...;;;;;;;;;;;;;x
EVTDESC_TIANXIA_316;The glow turns out to simply be the sunlight reflecting off of some metallic decorations set in the wall. However, those decorations appear to depict a battle against a dragon, and even though there is no actual writing on the wall the scenes depicted there give me several ideas as to how I could approach a similar fight in the future.;;;;;;;;;;;;;x
EVTOPTA_TIANXIA_316;This will be useful!;;;;;;;;;;;;;x
EVTDESC_TIANXIA_317;The wall is indeed glowing, and it is also covered with strange symbols. Judging by the number of them and how they are positioned, I suspect that it must be writing of some kind, but if so it is unlike any other writing I have ever seen before. It is impossible to say why anyone would have bothered with them or why the way to them was trapped.;;;;;;;;;;;;;x
EVTOPTA_TIANXIA_317;How curious...;;;;;;;;;;;;;x
EVTOPTB_TIANXIA_317;I must look for more like this!;;;;;;;;;;;;;x
EVTDESC_TIANXIA_318;The glow I noticed turns out to be coming from a number of gemstones that are reflecting the sunlight. Though perhaps not the most impressive gemstones I have seen, there is quite a few of them, and I manage to pry a number of them loose with ease. Though the way was fraught with peril, it seems I shall not leave empty-handed.;;;;;;;;;;;;;x
EVTOPTA_TIANXIA_318;A nice find indeed!;;;;;;;;;;;;;x
EVTDESC_TIANXIA_319;As I am passing through a small village on my way to the lair of Fredak, the Emperor of Embers I notice that there are a number of merchants there to trade, and I decide to investigate their wares. One of the merchants turns out to mainly be trading in books, including one about dragons that might be of interest to me.;;;;;;;;;;;;;x
EVTOPTA_TIANXIA_319;I'll purchase the book!;;;;;;;;;;;;;x
EVTOPTB_TIANXIA_319;Not interested!;;;;;;;;;;;;;x
EVTDESC_TIANXIA_320;The book I purchased from the merchant tells a story of two dragon brothers, one from the north and one from the south. Initially, they lived in harmony, but after a while they started to quarrel, and one of the dragons struck down its brother, upsetting the balance until the two reunited much later, choosing to walk together as humans.;;;;;;;;;;;;;x
EVTOPTA_TIANXIA_320;A story for children...;;;;;;;;;;;;;x
EVTDESC_TIANXIA_321;The book I purchased from the merchant tells the story of a band of brave adventurers on a quest to defeat the nefarious lord of a place referred to as "Highermost Darkstone Pinnacle", who apparently is a dragon. Unfortunately for the adventurers one of them did not pay attention and as a result they all died prior to reaching their true enemy.;;;;;;;;;;;;;x
EVTOPTA_TIANXIA_321;What a strange story...;;;;;;;;;;;;;x
EVTOPTB_TIANXIA_321;I wish I had chicken...;;;;;;;;;;;;;x
EVTDESC_TIANXIA_322;The book I purchased from the merchant is divided into several shorter stories about different people facing off against various legendary creatures. One of those people ends up having to fight a dragon, and the narrator carefully details how the hero manages to prevail, including strategies such as avoiding the dragon's fire.;;;;;;;;;;;;;x
EVTOPTA_TIANXIA_322;Fire is indeed bad!;;;;;;;;;;;;;x
EVTDESC_TIANXIA_323;The book I purchased from the merchant does not so much tell a story as it lists the problems with facing a dragon in combat. It goes into great detail about how the dragon has a number of advantages over any human foolish enough to challenge it. It seems its advice about fighting dragons is that it is to be avoided at all costs.;;;;;;;;;;;;;x
EVTOPTA_TIANXIA_323;That was unhelpful...;;;;;;;;;;;;;x
EVTDESC_TIANXIA_324;The book I purchased from the merchant turns out to contain a number of dragon-related sayings. While some of them vaguely might relate to fighting against dragons, there are few that seem like they might be trying to offer advice, and the few that do have unhelpful advice on the level of "Never tickle a sleeping dragon.";;;;;;;;;;;;;x
EVTOPTA_TIANXIA_324;None of this helps me...;;;;;;;;;;;;;x
EVTDESC_TIANXIA_325;The book I purchased tells a story about three dragonslayers from a frozen land "at the edge of the heavens". They set out to fight a fearsome black dragon and eventually learned a battlecry that they would shout at it, weakening it enough that they were able to defeat it, even if the book implies that they were not able to defeat it permanently.;;;;;;;;;;;;;x
EVTOPTA_TIANXIA_325;Will any battlecry do?;;;;;;;;;;;;;x
EVTDESC_TIANXIA_326;The book I purchased from the merchant turns out to contain some rather unusual advice. While I have heard many stories that tell how the fiery breath of a dragon is dangerous and others have told me about the dangers of the claws and bite of a dragon, no other story I have come across has mentioned that its tail also can be used as a weapon.;;;;;;;;;;;;;x
EVTOPTA_TIANXIA_326;The tail is also dangerous!;;;;;;;;;;;;;x
EVTDESC_TIANXIA_327;The book I purchased from the merchant contains a lot of information about dragons, going into great details about their scales, their legs, and more besides. However, I become somewhat concerned when I am unable to find any information about the wings, and my concern turns out to be warranted when I come across a drawing of a celestial dragon.;;;;;;;;;;;;;x
EVTOPTA_TIANXIA_327;That's the wrong kind of dragon...;;;;;;;;;;;;;x
EVTDESC_TIANXIA_328;The book I purchased from the merchant is a very strange one. It clearly describes of a dragon will breathe in deeply before unleashing a torrent of flames, but then the book starts speculating as to what makes the dragon want to breathe in deeply in the first place, proposing that things like the number of gnomes nearby might influence it.;;;;;;;;;;;;;x
EVTOPTA_TIANXIA_328;At least some of that was useful...;;;;;;;;;;;;;x
EVTDESC_TIANXIA_329;The book I purchased from the merchant starts out with a long description about dragons being giant lizards, which I suppose might be true, but instead of continuing on with something that actually is useful to know the book seems fit to compare dragons and lizards in great detain and contrasting various differences between the two.;;;;;;;;;;;;;x
EVTOPTA_TIANXIA_329;Who wrote this thing?;;;;;;;;;;;;;x
EVTDESC_TIANXIA_330;One day I come across a preacher spreading the word of the [conversion_province.Religion.GetName] faith. One of my companions mentions our quest where the preacher can overhear it, and I am soon told in no uncertain terms that only someone following the preacher's religion would be able to stand a chance against Fredak, the Emperor of Embers.;;;;;;;;;;;;;x
EVTOPTA_TIANXIA_330;I have to convert, then!;;;;;;;;;;;;;x
EVTOPTB_TIANXIA_330;I will take my chances!;;;;;;;;;;;;;x
EVTDESC_TIANXIA_331;Being on the road far from [Root.Capital.GetName] is quite relaxing, and I can finally take my mind off the problems I usually face at court. Come what may, this journey has been good to me, and I do not regret undertaking it.;;;;;;;;;;;;;x
EVTOPTA_TIANXIA_331;I feel like a new person!;;;;;;;;;;;;;x
EVTDESC_TIANXIA_332;The path to the lair of Fredak, the Emperor of Embers, is a long one, longer than I had expected. I find myself having less and less patience with the journey as time goes on, as I really want it to be over sooner rather than later.;;;;;;;;;;;;;x
EVTOPTA_TIANXIA_332;Are. We. There. Yet?;;;;;;;;;;;;;x
EVTDESC_TIANXIA_333;Though I and my companions have been trying to avoid the worst of the mud and grime on the road it is not possible to entirely avoid it, and it is also not possible to wash it off as quickly as I would have been able to back home. Strangely enough, I find myself minding it less as time goes on.;;;;;;;;;;;;;x
EVTOPTA_TIANXIA_333;Cleanliness is overrated!;;;;;;;;;;;;;x
EVTDESC_TIANXIA_334;Fredak, the Emperor of Embers, is a fearsome beast that must be hunted down. Of course, once my quest is over, there will be other beasts to hunt, and maybe I should put some effort into that when that time comes.;;;;;;;;;;;;;x
EVTOPTA_TIANXIA_334;I do like hunting!;;;;;;;;;;;;;x
EVTOPTB_TIANXIA_334;That is not something for me...;;;;;;;;;;;;;x
EVTDESC_TIANXIA_335;There were those back home that questioned whether setting out to hunt down Fredak, the Emperor of Embers, was a wise idea, and I was not entirely sure when I set off. However, during the journey I have come to realize that it is something I had to do.;;;;;;;;;;;;;x
EVTOPTA_TIANXIA_335;This is my purpose in life!;;;;;;;;;;;;;x
EVTDESC_TIANXIA_336;As I draw closer to the lair of Fredak, the Emperor of Embers, I cannot help but think of what else might be found at the dragon's lair. All the reports I have heard of the beast's attacks speak of the dragon having stolen a large quantity of gold, jewels, and other precious objects.;;;;;;;;;;;;;x
EVTOPTA_TIANXIA_336;Riches beyond measure!;;;;;;;;;;;;;x
EVTDESC_TIANXIA_337;I have been spending some of the time along the road playing various games of strategy with my companions, and I have been having a lot of fun. Perhaps, once this trip is over, I should dedicate myself even further to that sort of thing.;;;;;;;;;;;;;x
EVTOPTA_TIANXIA_337;I think I will!;;;;;;;;;;;;;x
EVTOPTB_TIANXIA_337;It's not for me...;;;;;;;;;;;;;x
EVTDESC_TIANXIA_338;At various points during the journey to the lair of Fredak, the Emperor of Embers, I have been discussing the upcoming battle with my companions, and I have realized that that kind of discussion can be rather interesting. Perhaps I should focus more on strategy once we return.;;;;;;;;;;;;;x
EVTOPTA_TIANXIA_338;Sounds like a plan!;;;;;;;;;;;;;x
EVTOPTB_TIANXIA_338;I think not...;;;;;;;;;;;;;x
EVTDESC_TIANXIA_339;I have been practicing with my weapons alongside my companions during the journey, and I feel that I have gotten better at using them. Though the fight against Fredak, the Emperor of Embers, doubtlessly will not be similar to fighting against another human, perhaps I have what it takes to take up duelling once the journey is over.;;;;;;;;;;;;;x
EVTOPTA_TIANXIA_339;I should do that!;;;;;;;;;;;;;x
EVTOPTB_TIANXIA_339;I think something else would be better...;;;;;;;;;;;;;x
EVTDESC_TIANXIA_340;As time goes on, I find that I do not mind the various detours we have to make during the trip as much as I did initially, and that I almost enjoy them in a way. You get to see quite a few interesting things you would not have come across otherwise, for one thing.;;;;;;;;;;;;;x
EVTOPTA_TIANXIA_340;And we are not in a hurry...;;;;;;;;;;;;;x
EVTDESC_TIANXIA_342;I and my party arrive at the lair of Fredak, the Emperor of Embers, but we are too late. The dragon has already been slain, and all of the treasures that we had expected to find in its lair are nowhere to be found, evidently looted prior to our arrival. It would appear that the journey has been a waste of time.;;;;;;;;;;;;;x
EVTOPTA_TIANXIA_342;Let's just head back...;;;;;;;;;;;;;x
EVTTITLE_TIANXIA_343;At the Dragon's Lair;;;;;;;;;;;;;x
EVTDESC_TIANXIA_343;I and my party arrive at the lair of Fredak, the Emperor of Embers, certain that the dragon is waiting inside. Most likely, it does not know that we are here, but we cannot know how long it will remain unaware of our arrival.\n\nWe discuss our options, and it turns out we have different ideas as to how to proceed. Some of those that are there with me think that we should attempt to sneak in, hopefully letting us catch the dragon by surprise, while others think that the direct approach is best... and a few even suggest that maybe we should turn around before it is too late...;;;;;;;;;;;;;x
EVTOPTA_TIANXIA_343;We should use stealth!;;;;;;;;;;;;;x
EVTOPTB_TIANXIA_343;We should take the direct approach!;;;;;;;;;;;;;x
EVTOPTC_TIANXIA_343;We should leave this place!;;;;;;;;;;;;;x
EVTDESC_TIANXIA_344;We make our way inside the lair, attempting to move as quietly as possible, but we are unsuccessful.\n\n"Who DARES enter MY lair?" the voice of Fredak, the Emperor of Embers, suddenly calls out.\n\nBefore we can react two of my guards are set ablaze by a sudden gout of flame, and I realize that the dragon is close indeed.;;;;;;;;;;;;;x
EVTOPTA_TIANXIA_344;To arms! To arms!;;;;;;;;;;;;;x
EVTDESC_TIANXIA_345;As we are stealthily making our way into the depths of the cavern in which Fredak, the Emperor of Embers, resides we come across a small pile of treasures. Though it certainly cannot be everything that the dragon has stolen, there is no doubt that there are some valuable objects to be found in this location.;;;;;;;;;;;;;x
EVTOPTA_TIANXIA_345;Grab what you can!;;;;;;;;;;;;;x
EVTOPTB_TIANXIA_345;We can loot the place later!;;;;;;;;;;;;;x
EVTDESC_TIANXIA_346;I am in the middle of going through the treasures when several of my guards cry out in agony. Turning around, I can see that they have been set ablaze, and I can also see the gargantuan head of Fredak, the Emperor of Embers, looking down on us.\n\n"Your greed will be the end of you," the dragon growls. "Face me and BURN!";;;;;;;;;;;;;x
EVTOPTA_TIANXIA_346;There you are!;;;;;;;;;;;;;x
EVTDESC_TIANXIA_347;I sort through the treasures until I find something that I like and quickly put it aside to make sure that none of the others in my party will claim it as their own as they all pick out a few minor items that interest them. One of my servants discreetly suggests that perhaps I could consider my quest to be over and head home.;;;;;;;;;;;;;x
EVTOPTA_TIANXIA_347;No, Fredak must fall!;;;;;;;;;;;;;x
EVTOPTB_TIANXIA_347;We should head home...;;;;;;;;;;;;;x
EVTDESC_TIANXIA_348;My companions are in a good mood as we move deeper into the cavern, and I think nothing of their laughter before I hear something move above me. As I look up I can see Fredak, the Emperor of Embers, looking down at your party.\n\n"Thieves BURN!" the dragon roars, breathing forth a gout of flame that engulfs several of my guards.;;;;;;;;;;;;;x
EVTOPTA_TIANXIA_348;To arms! To arms!;;;;;;;;;;;;;x
EVTDESC_TIANXIA_349;As my party makes its way around a corner I can see Fredak, the Emperor of Embers, lying ahead of us. The gargantuan crimson dragon appears to be asleep, which certainly is fortunate for us, and though I doubt that anyoune would be able to wound it particularly severely with just one blow we will hopefully be able to land one before it is able to react.;;;;;;;;;;;;;x
EVTOPTA_TIANXIA_349;SNEAK ATTACK!;;;;;;;;;;;;;x
