#CODE;ENGLISH;FRENCH;GERMAN;;SPANISH;;;;;;;;;x
EVTDESC_TIANXIA_350;I move closer to the sleeping form of Fredak, the Emperor of Embers, with my companions spreading out around the gargantuan creature. On my signal, we strike as one.\n\n"Did you intend to TICKLE me, INSECTS?" the dragon growls, sounding more amused than enraged as it opens its eyes and rises from the ground.;;;;;;;;;;;;;x
EVTOPTA_TIANXIA_350;Is talking all you do?;;;;;;;;;;;;;x
EVTDESC_TIANXIA_351;I move closer to the sleeping form of Fredak, the Emperor of Embers, with my companions spreading out around the gargantuan creature. On my signal, we strike as one.\n\n"You DARE attack ME in MY lair?" the dragon roars in pain, taking to the air in one swift motion. "You will all BURN!";;;;;;;;;;;;;x
EVTOPTA_TIANXIA_351;You are already bleeding!;;;;;;;;;;;;;x
EVTDESC_TIANXIA_352;I and my party successfully make our way deep inside the lair of Fredak, the Emperor of Embers, without any incidents on the way. As we enter a particularly large chamber we find ourselves looking into the eyes of Fredak, the Emperor of Embers.\n\n"It looks like I have GUESTS," he growls, leaping into the air.;;;;;;;;;;;;;x
EVTOPTA_TIANXIA_352;Face me, foul beast!;;;;;;;;;;;;;x
EVTDESC_TIANXIA_354;As my party is fighting the dragon [live_bait.GetBestName] suddenly trips and falls. [live_bait.GetSheHeCap] does not appear to be injured, but I can see Fredak, the Emperor of Embers, eyeing [live_bait.GetHerHim], and I suspect that the dragon is about to attack my companion. If I move quickly, I might be able to save [live_bait.GetHerHim].;;;;;;;;;;;;;x
EVTOPTA_TIANXIA_354;I should help [live_bait.GetHerHim]!;;;;;;;;;;;;;x
EVTOPTB_TIANXIA_354;We can use [live_bait.GetHerHim] as bait!;;;;;;;;;;;;;x
EVTDESC_TIANXIA_355;I react quickly and move to help [live_bait.GetBestName] back to [live_bait.GetHerHis] feet well before Fredak can make a move in our direction, and both of us manage to get out of the way with ease. My companion praises me for my assistance, and promises that [live_bait.GetSheHe] never will forget what I did for [live_bait.GetHerHim] this day.;;;;;;;;;;;;;x
EVTOPTA_TIANXIA_355;Think nothing of it!;;;;;;;;;;;;;x
EVTDESC_TIANXIA_356;I move to assist [live_bait.GetBestName] and manage to help [live_bait.GetHerHim] back onto [live_bait.GetHerHis] feet before Fredak can attack, but I am a bit slower than I should be and the dragon's claws tear into me before I can get out of the way. Luckily, [live_bait.GetBestName] is there to help me aside before I get a serious injury.;;;;;;;;;;;;;x
EVTOPTA_TIANXIA_356;We're in this together!;;;;;;;;;;;;;x
EVTDESC_TIANXIA_357;I manage to help [live_bait.GetBestName] get back to [live_bait.GetHerHis] feet and both of us try to take cover behind a raised portion of the uneven floor of the dragon's lair. Unfortunately, I manage to trip on the way there, and though my companion is able to drag me aside Fredak still lands a vicious blow on me before I am out of his reach.;;;;;;;;;;;;;x
EVTOPTA_TIANXIA_357;I'll survive this...;;;;;;;;;;;;;x
EVTDESC_TIANXIA_358;I ready your weapon to strike as Fredak attacks [live_bait.GetBestName]. My companion is almost back to [live_bait.GetHerHis] feet when the Fredak makes his attack, but [live_bait.GetSheHe] is unable to escape the dragon's wrath, much like the dragon is unable to avoid my blows. It is likely the rest of my companions know what I did.;;;;;;;;;;;;;x
EVTOPTA_TIANXIA_358;[live_bait.GetSheHeCap] died so that we can live!;;;;;;;;;;;;;x
EVTDESC_TIANXIA_359;I make myself ready to strike at Fredak, the Emperor of Embers, once he attacks [live_bait.GetBestName], but it would seem my companion is not content to play the part of the bait and successfully gets away before the dragon attacks [live_bait.GetHerHim]. Judging by the look I receive, [live_bait.GetSheHe] saw what I was planning.;;;;;;;;;;;;;x
EVTOPTA_TIANXIA_359;This is all a misunderstanding!;;;;;;;;;;;;;x
EVTDESC_TIANXIA_360;Fredak flies by overhead, and I manage to avoid his fangs and his claws with ease despite him making several attempts to strike at me with them. The tail lashes out he flies past, and I realize I need to dodge out of its way, though it is rather hard to tell which direction I should move in.;;;;;;;;;;;;;x
EVTOPTA_TIANXIA_360;I'll dodge to the right!;;;;;;;;;;;;;x
EVTOPTB_TIANXIA_360;Left! I dodge left!;;;;;;;;;;;;;x
EVTDESC_TIANXIA_361;I leap to the side as the tail strikes at me and manage to correctly guess which direction to move to avoid getting hit. Moreover, the dragon appears to have been distracted by the fact that it did not hit me, and several of my companions manage to land blows on it before it can fully recover from its confusion.;;;;;;;;;;;;;x
EVTOPTA_TIANXIA_361;That went well!;;;;;;;;;;;;;x
EVTDESC_TIANXIA_362;I leap to the side as the tail strikes at me, but I move in the wrong direction and am sent flying. I land quite hard, even if I do not think that any bones are broken, and though the dragon does not follow up on its attack on me at the moment I suspect that the blow might prove to be a disadvantage later on.;;;;;;;;;;;;;x
EVTOPTA_TIANXIA_362;That could have gone better...;;;;;;;;;;;;;x
EVTDESC_TIANXIA_363;"You were all FOOLS to come into MY lair," the dragon roars, letting out a gout of fire above our heads. "You will all BURN, and then I will seek out your loved ones and THEY will also BURN!"\n\nSeveral of my companions appear quite shaken by the dragon's words, and I have to admit that I also am a bit shaken.;;;;;;;;;;;;;x
EVTOPTA_TIANXIA_363;He... he lies!;;;;;;;;;;;;;x
EVTDESC_TIANXIA_364;I shout encouragements at my companions and see them become more determined to stand their ground. One of them cries out "[Root.GetBestName] and victory!", and others quickly take up the battlecry. Looking over at Fredak, the Emperor of Embers, I can see a look of puzzlement on the dragon's face.;;;;;;;;;;;;;x
EVTOPTA_TIANXIA_364;We shall triumph this day!;;;;;;;;;;;;;x
EVTDESC_TIANXIA_365;I make my best effort to strengthen the resolve of my companions, but I can see that it is not having the desired effect. Several of my guards even drop their weapons and attempt to run from the battle, only to get burned to a crisp as they flee. Looking at the dragon, I can see a cruel smile on its lips.;;;;;;;;;;;;;x
EVTOPTA_TIANXIA_365;We were fools to come here...;;;;;;;;;;;;;x
EVTDESC_TIANXIA_367;As I and [would_be_traitor.GetBestName] are moving around and trying to find a good angle my companion's leg suddenly gets in my way and I find myself falling to the ground. I look up at [would_be_traitor.GetHerHim] in surprise, and judging by the smile on [would_be_traitor.GetHerHis] face I was not tripped by accident.;;;;;;;;;;;;;x
EVTOPTA_TIANXIA_367;I should focus on getting back up;;;;;;;;;;;;;x
EVTOPTB_TIANXIA_367;I should focus on dragging them down;;;;;;;;;;;;;x
EVTDESC_TIANXIA_368;I get back to my feet before Fredak, the Emperor of Embers, can notice that I am in a vulnerable position, and I manage to find cover before he can attack [would_be_traitor.GetBestName] is nearby, and judging by their expression they are not particularly pleased that I escaped the dragon's wrath.;;;;;;;;;;;;;x
EVTOPTA_TIANXIA_368;I'll deal with this traitor later...;;;;;;;;;;;;;x
EVTDESC_TIANXIA_369;Angry at [would_be_traitor.GetBestName]'s betrayal, I decide to try to drag them down so that they will be an easier target for Fredak, the Emperor of Embers. Unfortunately, I am unable to get a grip of them before they can get out of the way, and since I was distracted I fail to move out of the way in time.;;;;;;;;;;;;;x
EVTOPTA_TIANXIA_369;Curses!;;;;;;;;;;;;;x
EVTDESC_TIANXIA_370;I reach out and drag [would_be_traitor.GetBestName] onto the ground next to me. Both of us attempt to get back on our feet and out of the way before Fredak, the Emperor of Embers, can attack us, but due to the actions of the other neither of us manages to escape without suffering grievous wounds from the dragon.;;;;;;;;;;;;;x
EVTOPTA_TIANXIA_370;At least [would_be_traitor.GetSheHe] also got hurt...;;;;;;;;;;;;;x
EVTDESC_TIANXIA_371;I reach out and grab onto [would_be_traitor.GetBestName], pulling myself up while also pulling them down. Seeing Fredak, the Emperor of Embers, moving in our direction, I run to the nearest cover I can find. Once there, I turn around just in time to see [would_be_traitor.GetBestName] take a grievous wound.;;;;;;;;;;;;;x
EVTOPTA_TIANXIA_371;That is what you get!;;;;;;;;;;;;;x
EVTDESC_TIANXIA_372;I suddenly find myself face-to-face with Fredak, the Emperor of Embers, and based on where I am standing I do not think I will be able to get to cover before the dragon can unleash its fire upon me.\n\n"Get out of here!" [died_for_you.GetBestName] suddenly shouts, jumping in the way of the dragon and taking a fatal blow for me.;;;;;;;;;;;;;x
EVTOPTA_TIANXIA_372;I will avenge you!;;;;;;;;;;;;;x
EVTDESC_TIANXIA_373;Fredak, the Emperor of Embers, suddenly lets out a deep roar and flies up towards the ceiling of the cavern. At first I expect him to dive down towards me or one of my companions, but instead the dragon starts attacking the ceiling, sending several large rocks falling down towards me and the others.;;;;;;;;;;;;;x
EVTOPTA_TIANXIA_373;Take cover!;;;;;;;;;;;;;x
EVTDESC_TIANXIA_374;My warning is timely, and I and all of my companions manage to avoid the rocks even though the dragon keeps dropping more of them towards us for some time. Several of the soldiers I have with me manage to hit the dragon with arrows, javelins, and other ranged weapons while it is distracted, and it lets out a roar of pain.;;;;;;;;;;;;;x
EVTOPTA_TIANXIA_374;That went well!;;;;;;;;;;;;;x
EVTDESC_TIANXIA_375;Though I shout out my warning and everyone runs for cover it is impossible to avoid all the rocks that are dropped towards us, and I and several others are struck by them. While I only am lightly injured some of the guards I brought with me are not so lucky, being crushed by the rocks.;;;;;;;;;;;;;x
EVTOPTA_TIANXIA_375;That's not good...;;;;;;;;;;;;;x
EVTDESC_TIANXIA_377;I and my companions keep fighting against Fredak, the Emperor of Embers, and it is hard to tell which side is winning at the moment. We have tried a few different tricks We planned ahead of time, but though some of them have paid off we have yet to win the battle. Perhaps it is time to try something more unconventional?;;;;;;;;;;;;;x
EVTOPTA_TIANXIA_377;Look behind you!;;;;;;;;;;;;;x
EVTOPTB_TIANXIA_377;Cheap tricks won't work...;;;;;;;;;;;;;x
EVTDESC_TIANXIA_378;To my surprise, Fredak, the Emperor of Embers, spins around in confusion upon hearing my words, and I and my companions manage to land several blows on the dragon before he realizes that he has been tricked.\n\n"You will BURN for this, INSECT!" he roars, and his voice sounds both pained and angry.;;;;;;;;;;;;;x
EVTOPTA_TIANXIA_378;That actually worked?;;;;;;;;;;;;;x
EVTDESC_TIANXIA_379;The dragon turns around, and my companions move in to strike at him, but the beast quickly turns back to face them and lets out a fiery breath, burning several of them quite badly.\n\n"You must be getting DESPERATE, if you have to use CHEAP TRICKS," Fredak growls, giving me a toothy smile. "What feeble effort shall be next?".;;;;;;;;;;;;;x
EVTOPTA_TIANXIA_379;Well, that didn't work...;;;;;;;;;;;;;x
EVTDESC_TIANXIA_380;Fredak, the Emperor of Embers, suddenly lands in front of me and starts to take a deep breath. I strongly suspect that he is about to breathe fire towards me, and it would probably be wise to move into cover, but the dragon has left its throat exposed, and I might be able to get close enough to strike before it breathes out.;;;;;;;;;;;;;x
EVTOPTA_TIANXIA_380;I attack the dragon!;;;;;;;;;;;;;x
EVTOPTB_TIANXIA_380;I take cover!;;;;;;;;;;;;;x
EVTDESC_TIANXIA_381;I move towards the dragon, deftly avoiding its claws, and strike at its exposed throat. Though the wound I inflict certainly is not fatal, it is still a noticeable wound, and the dragon roars in pain and leaps back into the air, seemingly having forgotten its plan to breathe fire.;;;;;;;;;;;;;x
EVTOPTA_TIANXIA_381;An exploitable weakness, it seems...;;;;;;;;;;;;;x
EVTDESC_TIANXIA_382;As I move towards the dragon one of its limbs reach out and swats me aside. Though I am sent far enough away from the dragon that I no longer am in danger of being burned by its breath, I still take a fierce blow. Luckily, nothing appers to have broken from either the initial attack or the impact when I hit the wall.;;;;;;;;;;;;;x
EVTOPTA_TIANXIA_382;That did not go well...;;;;;;;;;;;;;x
EVTDESC_TIANXIA_383;As I am considering my next move against the dragon I spot a patch of discolored scales close to where I expect its heart to be. It is quite possibly an old wound, and if so it is quite possible that it has not yet healed completely, which might mean it is a possible weak spot worth attacking.;;;;;;;;;;;;;x
EVTOPTA_TIANXIA_383;I will stike at the discoloration!;;;;;;;;;;;;;x
EVTOPTB_TIANXIA_383;It wouldn't work...;;;;;;;;;;;;;x
EVTDESC_TIANXIA_384;I strike at the patch of discolored scales when next I attack the dragon. It lets out a roar of pain and rage when I hit it, and judging by the fact that it tries to cover that part of its body as best it can while still fighting I am reasonably certain that it indeed was an old wound;;;;;;;;;;;;;x
EVTOPTA_TIANXIA_384;I should try to strike there again!;;;;;;;;;;;;;x
EVTDESC_TIANXIA_385;I strike at the patch of discolored scales, but to my dismay all that happens is that a few of them come loose, revealing that they were concealing scales with the same crimson color as the rest of the dragon. I find myself unsure if various other spots I thought were wounds also simply were old scales.;;;;;;;;;;;;;x
EVTOPTA_TIANXIA_385;That did not work...;;;;;;;;;;;;;x
EVTTITLE_TIANXIA_388;Fire and Blood;;;;;;;;;;;;;x
EVTDESC_TIANXIA_388;My party keeps on fighting Fredak, the Emperor of Embers, but even though we land the occasional blow the battle is not going our way. One by one, we meet our end, by fang, by claw, or by fire.\n\nIt almost seem as if the dragon is toying with me in particular, as I am the last person standing and manage to stay alive for some time, but eventually it knocks me to the ground and leans down towards me.\n\n"You should have known not to challenge ME, little human," it growls, opening its jaws wide and letting out a massive torrent of fire that is the last thing I see.;;;;;;;;;;;;;x
EVTOPTA_TIANXIA_388;Could anyone prevail?;;;;;;;;;;;;;x
EVTTITLE_TIANXIA_389;Defiant to the Last;;;;;;;;;;;;;x
EVTDESC_TIANXIA_389;The fight against Fredak, the Emperor of Embers, goes well at first, but soon the tide turns, and the dragon starts picking off my companions one by one. It takes several wounds in the process, to be sure, and actually appears to be in pain, but even so none of us actually manage to slay it.\n\n"I have to admit you fought well, litte human," the dragon growls towards me when I am the only one left alive from my party. It inclines its head very slightly, then gives me a toothy smile. "But not well enough. Make peace with whatever gods you pray to!";;;;;;;;;;;;;x
EVTOPTA_TIANXIA_389;Someone will finish the job!;;;;;;;;;;;;;x
EVTTITLE_TIANXIA_390;The Dragon Lies Bleeding;;;;;;;;;;;;;x
EVTDESC_TIANXIA_390;It is done! Fredak, the Emperor of Embers, lets out one final, weak roar and then stops moving. Fearing a trap, I and the others that fought the beast keep attacking it for seveal minutes, but we stop once it is clear that it actually is dead. From this day and until the end of days I shall be known as [Root.GetTitledFirstName] the Dragonslayer!\n\nNow that the beast is out of the way, it is high time for me and and my companions to discover where it keeps the treasures it has collected, as we certainly deserve whatever spoils we may find.;;;;;;;;;;;;;x
EVTOPTA_TIANXIA_390;We did it!;;;;;;;;;;;;;x
EVTDESC_TIANXIA_391;Word has reached me that Fredak, the Emperor of Embers, has been slain by a party of adventurers assembled by [From.GetTitledName], now known as [From.GetBestName]. Without doubt, [From.GetSheHe] and [From.GetHerHis] party has already taken possession of anything of value that could be found in the dragon's lair.;;;;;;;;;;;;;x
EVTOPTA_TIANXIA_391;A glorious victory, to be sure!;;;;;;;;;;;;;x
EVTOPTB_TIANXIA_391;I guess we should head home...;;;;;;;;;;;;;x
EVTDESC_TIANXIA_392;At the very heart of the dragon's lair my party finds a chamber that is all but overflowing with gold, silver, precious gems, and artifacts of various kinds. Some of my companions see fit to take some of the lesser pieces for themselves, which I do not particularly care about as there are greater riches for me to claim as my own.;;;;;;;;;;;;;x
EVTOPTA_TIANXIA_392;Riches untold!;;;;;;;;;;;;;x
EVTDESC_TIANXIA_395;I have been on the road for quite some time, and at times it has felt as if I never might see my home again, but eventually I start to recognize some familiar landmarks, and it is not long before I and my companions reach our destination.;;;;;;;;;;;;;x
EVTOPTA_TIANXIA_395;Home at last!;;;;;;;;;;;;;x